Symbol,Name,Last Sale,Net Change,% Change,Market Cap,Country,IPO Year,Volume,Sector,Industry
IRWD,Ironwood Pharmaceuticals Inc. Class A Common Stock,$11.40,-0.14,-1.213%,1748708438.00,United States,2010,2281900,Health Care,Biotechnology: Pharmaceutical Preparations
ISEE,IVERIC bio Inc. Common Stock,$23.24,-0.75,-3.126%,3115851918.00,United States,2013,1683137,Health Care,Biotechnology: Pharmaceutical Preparations
ISIG,Insignia Systems Inc. Common Stock,$9.01,-0.19,-2.065%,16186519.00,United States,1991,5198,Consumer Discretionary,Advertising
ISO,IsoPlexis Corporation Common Stock,$1.45,0.01,0.694%,58478391.00,United States,2021,88983,Health Care,Biotechnology: Electromedical & Electrotherapeutic Apparatus
ISPC,iSpecimen Inc. Common Stock,$1.68,-0.07,-4.00%,14982991.00,United States,2021,8864,Health Care,Precision Instruments
ISPO,Inspirato Incorporated Class A Common Stock,$1.23,0.01,0.82%,72414823.00,United States,2021,210727,Consumer Discretionary,Hotels/Resorts
ISPOW,Inspirato Incorporated Warrant,$0.1041,-0.0059,-5.364%,0.00,United States,2021,8154,Consumer Discretionary,Hotels/Resorts
ISRG,Intuitive Surgical Inc. Common Stock,$254.68,-6.22,-2.384%,89999982288.00,United States,2000,1691349,Health Care,Medical/Dental Instruments
ISRLU,Israel Acquisitions Corp Unit,$10.17,0.00,0.00%,0.00,United States,2023,50912,,
ISSC,Innovative Solutions and Support Inc. Common Stock,$8.72,0.52,6.341%,151433473.00,United States,2000,64281,Industrials,Military/Government/Technical
ISTR,Investar Holding Corporation Common Stock,$20.63,-0.19,-0.913%,204275104.00,United States,2014,25779,Finance,Commercial Banks
ISUN,iSun Inc. Common Stock,$1.99,-0.02,-0.995%,30624215.00,United States,2016,44980,Technology,Semiconductors
ITAQ,Industrial Tech Acquisitions II Inc. Class A Common Stock,$10.27,0.00,0.00%,221446875.00,United States,2022,30,Industrials,Consumer Electronics/Appliances
ITAQU,Industrial Tech Acquisitions II Inc. Unit,$10.30,0.00,0.00%,0.00,United States,2022,1100,Industrials,Consumer Electronics/Appliances
ITAQW,Industrial Tech Acquisitions II Inc. Warrants,$0.101,0.001,1.00%,0.00,United States,2022,601,Industrials,Consumer Electronics/Appliances
ITCI,Intra-Cellular Therapies Inc. Common Stock,$48.92,-0.82,-1.649%,4632971242.00,United States,,573096,Health Care,Biotechnology: Pharmaceutical Preparations
ITI,Iteris Inc. Common Stock,$4.47,0.50,12.594%,190596871.00,United States,,593538,Telecommunications,Telecommunications Equipment
ITIC,Investors Title Company Common Stock,$158.50,-6.28,-3.811%,300671647.00,United States,,2056,Finance,Specialty Insurers
ITOS,iTeos Therapeutics Inc. Common Stock,$20.77,0.47,2.315%,738899459.00,United States,2020,266135,Health Care, Medicinal Chemicals and Botanical Products 
ITQ,Itiquira Acquisition Corp. Class A Ordinary Shares,$10.15,0.00,0.00%,291812500.00,United States,2021,3,Finance,Business Services
ITQRU,Itiquira Acquisition Corp. Unit,$10.15,-0.0142,-0.14%,0.00,United States,2021,30812,Finance,Business Services
ITQRW,Itiquira Acquisition Corp. Warrant,$0.0073,0.0058,386.667%,0.00,United States,2021,7666,Finance,Business Services
ITRI,Itron Inc. Common Stock,$59.27,-0.60,-1.002%,2677699645.00,United States,1993,234755,Industrials,Electrical Products
ITRM,Iterum Therapeutics plc Ordinary Share,$1.475,0.025,1.724%,18044227.00,Ireland,2018,104565,Health Care,Biotechnology: Pharmaceutical Preparations
ITRN,Ituran Location and Control Ltd. Ordinary Shares,$22.58,0.02,0.089%,457634031.00,Israel,2005,12195,Technology,Electronic Components
IVA,Inventiva S.A. American Depository Shares,$6.10,0.01,0.164%,257018431.00,France,2020,2289,Consumer Discretionary,Other Consumer Services
IVAC,Intevac Inc. Common Stock,$6.82,-0.05,-0.728%,173505274.00,United States,1995,182089,Technology,Industrial Machinery/Components
IVCA,Investcorp India Acquisition Corp. Class A Ordinary Share,$10.42,0.00,0.00%,337021875.00,Cayman Islands,2022,3,Finance,Business Services
IVCAW,Investcorp India Acquisition Corp. Warrant,$0.101,0.00,0.00%,0.00,Cayman Islands,2022,6,Finance,Business Services
IVCB,Investcorp Europe Acquisition Corp I Class A Ordinary Shares,$10.37,-0.01,-0.096%,447206250.00,Cayman Islands,2022,325269,Finance,Business Services
IVCBW,Investcorp Europe Acquisition Corp I Warrant,$0.03,0.00,0.00%,0.00,Cayman Islands,2022,2500,Finance,Business Services
IVCP,Swiftmerge Acquisition Corp. Class A Ordinary Share,$10.21,-0.01,-0.098%,287156250.00,United States,2022,661,Finance,Business Services
IVCPW,Swiftmerge Acquisition Corp. Warrants,$0.0801,-0.0001,-0.125%,0.00,United States,2022,16400,Finance,Business Services
IVDA,Iveda Solutions Inc. Common Stock,$1.22,0.06,5.172%,18259422.00,United States,,993390,Technology,Security Systems Services
IVDAW,Iveda Solutions Inc. Warrant,$0.5237,0.148,39.393%,0.00,United States,,651,Technology,Security Systems Services
IVVD,Invivyd Inc. Common Stock,$2.10,-0.18,-7.895%,228863042.00,United States,2021,560097,Health Care,Biotechnology: Pharmaceutical Preparations
IXAQ,IX Acquisition Corp. Class A Ordinary Share,$10.20,-0.01,-0.098%,293250000.00,United Kingdom,2021,1168198,Finance,Business Services
IXAQW,IX Acquisition Corp. Warrant,$0.025,0.005,25.00%,0.00,United Kingdom,2021,42200,Finance,Business Services
IXHL,Incannex Healthcare Limited American Depositary Shares,$3.465,0.225,6.944%,211170083.00,Australia,,19147,,
IZEA,IZEA Worldwide Inc. Common Stock,$0.76,0.025,3.401%,47367065.00,United States,,531532,Consumer Discretionary,Advertising
JACK,Jack In The Box Inc. Common Stock,$78.25,-1.10,-1.386%,1611776207.00,United States,,240261,Consumer Discretionary,Restaurants
JAGX,Jaguar Health Inc. Common Stock,$4.70,0.18,3.982%,9476892.00,United States,2015,980970,Health Care,Biotechnology: Pharmaceutical Preparations
JAKK,JAKKS Pacific Inc. Common Stock,$21.37,-0.08,-0.373%,207791922.00,United States,1996,49470,Consumer Discretionary,Recreational Games/Products/Toys
JAMF,Jamf Holding Corp. Common Stock,$22.01,-0.21,-0.945%,2671735287.00,United States,2020,165126,Technology,Computer Software: Prepackaged Software
JAN,JanOne Inc. Common Stock (NV),$1.60,-0.0399,-2.433%,5040368.00,United States,,23592,Utilities,Environmental Services
JANX,Janux Therapeutics Inc. Common Stock,$21.00,-0.84,-3.846%,874923609.00,United States,2021,63620,Health Care,Biotechnology: Pharmaceutical Preparations
JAQC,Jupiter Acquisition Corporation Common stock,$10.01,-0.005,-0.05%,203178465.00,United States,2021,889,Industrials,Consumer Electronics/Appliances
JAQCU,Jupiter Acquisition Corporation Units,$10.00,-0.04,-0.398%,0.00,United States,2021,500,Industrials,Consumer Electronics/Appliances
JAZZ,Jazz Pharmaceuticals plc Common Stock (Ireland),$155.64,-0.76,-0.486%,9800078045.00,Ireland,2007,402385,Health Care,Biotechnology: Pharmaceutical Preparations
JBHT,J.B. Hunt Transport Services Inc. Common Stock,$197.89,0.54,0.274%,20529702270.00,United States,,745990,Industrials,Trucking Freight/Courier Services
JBLU,JetBlue Airways Corporation Common Stock,$8.73,-0.49,-5.315%,2827451570.00,United States,2002,10916633,Consumer Discretionary,Air Freight/Delivery Services
JBSS,John B. Sanfilippo & Son Inc. Common Stock,$92.87,0.79,0.858%,1070501810.00,United States,1991,99087,Consumer Staples,Specialty Foods
JCSE,JE Cleantech Holdings Limited Ordinary Shares,$0.739,0.029,4.085%,11099780.00,Singapore,2022,27564,Consumer Discretionary,Miscellaneous manufacturing industries
JCTCF,Jewett-Cameron Trading Company Common Shares,$5.35,0.00,0.00%,18719110.00,United States,,1763,,
JD,JD.com Inc. American Depositary Shares,$57.63,-1.68,-2.833%,90219765000.00,China,2014,6160302,Consumer Discretionary,Catalog/Specialty Distribution
JEWL,Adamas One Corp. Common Stock,$2.13,0.02,0.948%,42924288.00,United States,2022,113644,Consumer Discretionary,Consumer Specialties
JFBR,Jeffs' Brands Ltd Ordinary Shares,$1.05,-0.0076,-0.719%,8477928.00,Israel,2022,83795,Miscellaneous,Diversified Commercial Services
JFBRW,Jeffs' Brands Ltd Warrant,$0.1448,0.0148,11.385%,0.00,Israel,2022,1671,Miscellaneous,Diversified Commercial Services
JFIN,Jiayin Group Inc. American Depositary Shares,$3.432,-0.1131,-3.19%,183067211.00,China,2019,40850,Finance,Finance: Consumer Services
JFU,9F Inc. American Depositary Shares,$4.07,-0.19,-4.46%,47258125.00,China,2019,26466,Finance,Finance: Consumer Services
JG,Aurora Mobile Limited American Depositary Shares,$0.80,0.02,2.564%,95083686.00,China,2018,31341,Technology,EDP Services
JGGC,Jaguar Global Growth Corporation I Class A Ordinary Shares,$10.36,-0.02,-0.193%,317706670.00,United States,2022,1371,Finance,Business Services
JGGCR,Jaguar Global Growth Corporation I Right,$0.12,0.04,50.00%,0.00,United States,2022,249,Finance,Business Services
JGGCU,Jaguar Global Growth Corporation I Unit,$10.42,0.11,1.067%,0.00,United States,2022,820,Finance,Business Services
JGGCW,Jaguar Global Growth Corporation I Warrant,$0.09,0.0099,12.36%,0.00,United States,2022,83400,Finance,Business Services
JJSF,J & J Snack Foods Corp. Common Stock,$141.23,0.36,0.256%,2715711670.00,United States,1986,138579,Consumer Staples,Specialty Foods
JKHY,Jack Henry & Associates Inc. Common Stock,$180.70,-1.77,-0.97%,13181962543.00,United States,1985,445372,Technology,Retail: Computer Software & Peripheral Equipment
JMAC,Maxpro Capital Acquisition Corp. Class A Common Stock,$10.4541,0.0341,0.327%,140372689.00,Taiwan,2021,300,Industrials,Consumer Electronics/Appliances
JMACU,Maxpro Capital Acquisition Corp. Units,$10.42,0.01,0.096%,0.00,Taiwan,2021,120,Industrials,Consumer Electronics/Appliances
JMACW,Maxpro Capital Acquisition Corp. Warrants,$0.04,0.0044,12.36%,0.00,Taiwan,2021,11000,Industrials,Consumer Electronics/Appliances
JMSB,John Marshall Bancorp Inc. Common Stock,$27.70,0.28,1.021%,390541912.00,United States,,21088,Finance,Major Banks
JNCE,Jounce Therapeutics Inc. Common Stock,$1.21,0.00,0.00%,62550027.00,United States,2017,388782,Health Care,Biotechnology: Pharmaceutical Preparations
JOAN,JOANN Inc. Common Stock,$4.46,-0.16,-3.463%,181909989.00,United States,2021,159310,Consumer Discretionary,Department/Specialty Retail Stores
JOUT,Johnson Outdoors Inc. Class A Common Stock,$67.69,-3.80,-5.315%,693229333.00,United States,,76162,Consumer Discretionary,Recreational Games/Products/Toys
JRSH,Jerash Holdings (US) Inc. Common Stock,$4.40,0.049,1.126%,54536623.00,United States,2018,6180,Consumer Discretionary,Industrial Specialties
JRVR,James River Group Holdings Ltd. Common Shares,$23.41,0.49,2.138%,876939560.00,Bermuda,2014,218412,Finance,Property-Casualty Insurers
JSM,Navient Corporation 6% Senior Notes due December 15 2043,$20.87,-0.31,-1.464%,0.00,United States,,10159,Finance,Finance: Consumer Services
JSPR,Jasper Therapeutics Inc. Common Stock,$1.93,0.15,8.427%,210991198.00,United States,2020,2550523,Health Care,Biotechnology: Pharmaceutical Preparations
JSPRW,Japer Therapeutics Inc. Warrants,$0.1649,0.0061,3.841%,0.00,United States,2020,4674,Health Care,Biotechnology: Pharmaceutical Preparations
JUGG,Jaws Juggernaut Acquisition Corporation Class A Ordinary Share,$10.14,0.00,0.00%,349830000.00,United States,2021,1934,,
JUPW,Jupiter Wellness Inc. Common Stock,$0.64,0.0052,0.819%,17058992.00,United States,2020,245669,Health Care,Biotechnology: Pharmaceutical Preparations
JUPWW,Jupiter Wellness Inc. Warrant,$0.1011,0.00,0.00%,0.00,United States,2020,1717,Health Care,Biotechnology: Pharmaceutical Preparations
JVA,Coffee Holding Co. Inc. Common Stock,$2.63,-0.07,-2.593%,15013615.00,United States,2005,17055,Consumer Staples,Specialty Foods
JWAC,Jupiter Wellness Acquisition Corp. Class A Common Stock,$10.31,0.00,0.00%,187178050.00,United States,2022,1,Industrials,Consumer Electronics/Appliances
JWACR,Jupiter Wellness Acquisition Corp. Right,$0.08,-0.0218,-21.415%,0.00,United States,2022,1114,Finance,Business Services
JWEL,Jowell Global Ltd. Ordinary Shares,$0.485,-0.0097,-1.961%,15271784.00,China,2021,112258,Consumer Discretionary,Other Consumer Services
JXJT,JX Luxventure Limited Common Stock,$0.8701,-0.0116,-1.316%,2254689.00,China,2013,126325,Consumer Staples,Apparel
JYNT,The Joint Corp. Common Stock,$18.51,-0.07,-0.377%,268944358.00,United States,2014,97953,,
JZ,Jianzhi Education Technology Group Company Limited American Depositary Shares,$1.7114,-0.0486,-2.761%,103633827.00,China,2022,156036,Real Estate,Other Consumer Services
JZXN,Jiuzi Holdings Inc. Ordinary Shares,$0.199,-0.0011,-0.55%,5115887.00,China,2021,6907193,Consumer Discretionary,Retail-Auto Dealers and Gas Stations
KA,Kineta Inc. Common Stock,$7.86,0.08,1.028%,76724125.00,United States,2016,8146,Health Care,Biotechnology: Pharmaceutical Preparations
KACLR,Kairous Acquisition Corp. Limited Rights,$0.275,0.035,14.583%,0.00,Malaysia,2022,22180,Finance,Business Services
KACLW,Kairous Acquisition Corp. Limited Warrants,$0.0801,0.00,0.00%,0.00,Malaysia,2022,11950,Finance,Business Services
KAII,Kismet Acquisition Two Corp. Class A Ordinary Shares,$10.15,-0.02,-0.197%,360325000.00,United States,2021,220535,Finance,Business Services
KAIIW,Kismet Acquisition Two Corp. Warrant,$0.02,0.00,0.00%,0.00,United States,2021,60000,Finance,Business Services
KAL,Kalera Public Limited Company Ordinary Shares,$6.75,0.70,11.57%,6201752.00,Ireland,,6005993,Consumer Staples,Farming/Seeds/Milling
KALA,Kala Pharmaceuticals Inc. Common Stock,$17.58,-0.47,-2.604%,985532427.00,United States,2017,106311,Health Care,Biotechnology: Pharmaceutical Preparations
KALU,Kaiser Aluminum Corporation Common Stock,$93.92,1.19,1.283%,1497143500.00,United States,,111143,Industrials,Aluminum
KALV,KalVista Pharmaceuticals Inc. Common Stock,$7.87,0.25,3.281%,268385471.00,United Kingdom,2015,226301,Health Care,Biotechnology: Pharmaceutical Preparations
KALWW,Kalera Public Limited Company Warrant,$0.0492,0.0192,64.00%,0.00,Ireland,,6712890,Consumer Staples,Farming/Seeds/Milling
KARO,Karooooo Ltd. Ordinary Shares,$25.87,0.82,3.273%,800705112.00,Singapore,2021,10401,Technology,Computer Software: Prepackaged Software
KAVL,Kaival Brands Innovations Group Inc. Common Stock,$0.7651,-0.0049,-0.636%,42974971.00,United States,,90839,Health Care, Medicinal Chemicals and Botanical Products 
KBAL,Kimball International Inc. Class B Common Stock,$7.46,-0.30,-3.866%,272838355.00,United States,,140553,Consumer Discretionary,Industrial Specialties
KBNT,Kubient Inc. Common Stock,$1.24,0.08,6.897%,17859100.00,United States,2020,107583,Technology,EDP Services
KBNTW,Kubient Inc. Warrant,$0.0995,-0.0005,-0.50%,0.00,United States,2020,1500,Technology,EDP Services
KC,Kingsoft Cloud Holdings Limited American Depositary Shares,$5.01,-0.32,-6.004%,1270965122.00,China,2020,1454100,Technology,Computer Software: Prepackaged Software
KDNY,Chinook Therapeutics Inc. Common Stock,$24.08,-1.27,-5.01%,1539690130.00,United States,2015,522493,Health Care,Biotechnology: Pharmaceutical Preparations
KDP,Keurig Dr Pepper Inc. Common Stock,$35.15,-0.06,-0.17%,49781233441.00,United States,,7050794,Consumer Staples,Beverages (Production/Distribution)
KE,Kimball Electronics Inc. Common Stock,$25.39,0.08,0.316%,627395304.00,United States,,85398,Technology,Industrial Machinery/Components
KELYA,Kelly Services Inc. Class A Common Stock,$18.73,-0.11,-0.584%,710766452.00,United States,,161301,Consumer Discretionary,Diversified Commercial Services
KELYB,Kelly Services Inc. Class B Common Stock,$18.62,0.12,0.649%,706592170.00,United States,,2178,Consumer Discretionary,Diversified Commercial Services
KEQU,Kewaunee Scientific Corporation Common Stock,$16.15,0.01,0.062%,45707730.00,United States,,217,Industrials,Medical Specialities
KERN,Akerna Corp. Common Stock,$1.06,-0.06,-5.357%,14902229.00,United States,2018,406597,Health Care,Managed Health Care
KERNW,Akerna Corp Warrant,$0.0169,-0.0007,-3.977%,0.00,United States,2018,46796,Health Care,Managed Health Care
KFFB,Kentucky First Federal Bancorp Common Stock,$6.75,-0.077,-1.128%,55044191.00,United States,2005,268,Finance,Savings Institutions
KFRC,Kforce Inc. Common Stock,$58.33,0.34,0.586%,1210560171.00,United States,1995,127142,Consumer Discretionary,Diversified Commercial Services
KHC,The Kraft Heinz Company Common Stock,$39.38,-0.61,-1.525%,48237749858.00,United States,,6196096,Consumer Staples,Farming/Seeds/Milling
KIDS,OrthoPediatrics Corp. Common Stock,$48.62,-1.15,-2.311%,1112984730.00,United States,2017,114019,Health Care,Medical/Dental Instruments
KINS,Kingstone Companies Inc. Common Stock,$1.65,-0.0358,-2.124%,17629423.00,United States,,6381,Finance,Specialty Insurers
KINZ,KINS Technology Group Inc. Class A Common Stock,$10.14,0.01,0.099%,79477320.00,United States,2021,276,Industrials,Consumer Electronics/Appliances
KINZW,KINS Technology Group Inc. Warrant,$0.065,-0.0089,-12.043%,0.00,United States,2021,29519,Industrials,Consumer Electronics/Appliances
KIRK,Kirkland's Inc. COMMONSTOCK,$3.89,0.07,1.832%,49614492.00,United States,2002,164008,Miscellaneous,Diversified Commercial Services
KITT,Nauticus Robotics Inc. Common stock,$3.55,0.23,6.928%,167740237.00,United States,2021,62122,Industrials,Metal Fabrications
KITTW,Nauticus Robotics Inc. Warrant,$0.2526,0.0126,5.25%,0.00,United States,2021,200,Industrials,Metal Fabrications
KLAC,KLA Corporation Common Stock,$408.27,-5.99,-1.446%,56537133248.00,United States,1980,1080535,Technology,Electronic Components
KLIC,Kulicke and Soffa Industries Inc. Common Stock,$56.53,-1.73,-2.969%,3215966148.00,Singapore,,833422,Technology,Semiconductors
KLTR,Kaltura Inc. Common Stock,$2.10,0.02,0.962%,279856212.00,United States,2021,75986,Technology,EDP Services
KLXE,KLX Energy Services Holdings Inc. Common Stock,$13.84,-0.11,-0.789%,169891716.00,United States,,105143,Energy,Oilfield Services/Equipment
KMDA,Kamada Ltd. Ordinary Shares,$4.69,-0.07,-1.471%,210114364.00,Israel,2013,18121,Health Care,Biotechnology: Pharmaceutical Preparations
KMPH,KemPharm Inc. Common Stock,$5.59,-0.04,-0.71%,192882179.00,United States,,140752,Health Care,Biotechnology: Pharmaceutical Preparations
KNDI,Kandi Technologies Group Inc Common Stock,$2.60,-0.06,-2.256%,193005101.00,China,,154317,Consumer Discretionary,Auto Parts:O.E.M.
KNSA,Kiniksa Pharmaceuticals Ltd. Class A Common Stock,$14.10,-0.07,-0.494%,980397844.00,United States,2018,619411,Health Care,Biotechnology: Pharmaceutical Preparations
KNTE,Kinnate Biopharma Inc. Common Stock,$7.52,-0.46,-5.764%,332118416.00,United States,2020,96443,Health Care,Biotechnology: Pharmaceutical Preparations
KOD,Kodiak Sciences Inc Common Stock,$8.58,0.11,1.299%,448812541.00,United States,2018,182638,Health Care,Biotechnology: Pharmaceutical Preparations
KOPN,Kopin Corporation Common Stock,$1.39,0.03,2.206%,151682997.00,United States,1992,704314,Technology,Industrial Machinery/Components
KOSS,Koss Corporation Common Stock,$5.80,-0.12,-2.027%,53300811.00,United States,,25329,Consumer Staples,Consumer Electronics/Appliances
KPLT,Katapult Holdings Inc. Common Stock,$1.07,0.01,0.943%,105339621.00,United States,2019,314362,Technology,EDP Services
KPLTW,Katapult Holdings Inc. Warrant,$0.1399,0.0299,27.182%,0.00,United States,2019,3829,Technology,EDP Services
KPRX,Kiora Pharmaceuticals Inc.  Common Stock,$3.54,-0.02,-0.562%,6359511.00,United States,,41165,Health Care,Biotechnology: In Vitro & In Vivo Diagnostic Substances
KPTI,Karyopharm Therapeutics Inc. Common Stock,$3.40,-0.11,-3.134%,384924768.00,United States,2013,2020846,Miscellaneous,Diversified Commercial Services
KRBP,Kiromic BioPharma Inc. Common Stock,$0.2285,0.0243,11.90%,4685324.00,United States,2020,8008507,Health Care, Medicinal Chemicals and Botanical Products 
KRKR,36Kr Holdings Inc. American Depositary Shares,$1.1506,-0.0295,-2.50%,46733377.00,China,2019,33129,Consumer Discretionary,Business Services
KRMD,KORU Medical Systems Inc. Common Stock,$3.90,-0.02,-0.51%,176591797.00,United States,,16185,Health Care,Medical/Dental Instruments
KRNL,Kernel Group Holdings Inc. Class A Ordinary Shares,$10.21,0.05,0.492%,388937188.00,United States,2021,6397,Finance,Business Services
KRNLU,Kernel Group Holdings Inc. Units,$10.22,0.03,0.294%,0.00,United States,2021,100,Finance,Business Services
KRNLW,Kernel Group Holdings Inc. Warrants,$0.1201,0.0201,20.10%,0.00,United States,2021,43285,Finance,Business Services
KRNT,Kornit Digital Ltd. Ordinary Shares,$27.59,-1.20,-4.168%,1377085654.00,Israel,2015,290330,Industrials,Industrial Machinery/Components
KRNY,Kearny Financial Corp Common Stock,$10.28,0.19,1.883%,692748640.00,United States,2005,354692,Finance,Savings Institutions
KRON,Kronos Bio Inc. Common Stock,$2.27,-0.16,-6.584%,129159309.00,United States,2020,383797,Health Care, Medicinal Chemicals and Botanical Products 
KROS,Keros Therapeutics Inc. Common Stock,$57.43,-0.47,-0.812%,1581808905.00,United States,2020,452213,Health Care, Medicinal Chemicals and Botanical Products 
KRT,Karat Packaging Inc. Common Stock,$15.20,0.22,1.469%,302601782.00,United States,2021,5066,Industrials,Office Equipment/Supplies/Services
KRTX,Karuna Therapeutics Inc. Common Stock,$191.99,-2.57,-1.321%,6597309556.00,United States,2019,212422,Health Care,Biotechnology: Pharmaceutical Preparations
KRUS,Kura Sushi USA Inc. Class A Common Stock,$61.78,-0.40,-0.643%,604960633.00,United States,2019,150650,Consumer Discretionary,Restaurants
KRYS,Krystal Biotech Inc. Common Stock,$80.21,-0.37,-0.459%,2065218766.00,United States,2017,155601,Health Care,Biotechnology: Biological Products (No Diagnostic Substances)
KSCP,Knightscope Inc. Class A Common Stock,$1.66,0.02,1.22%,63817505.00,United States,2022,481330,Technology,Security Systems Services
KSI,Kadem Sustainable Impact Corporation Class A common stock,$10.095,0.005,0.05%,220828125.00,United States,2021,204,Industrials,Consumer Electronics/Appliances
KSICW,Kadem Sustainable Impact Corporation Warrant,$0.0477,0.0315,194.444%,0.00,United States,2021,1395,Industrials,Consumer Electronics/Appliances
KSPN,Kaspien Holdings Inc. Common Stock,$0.845,0.085,11.184%,4195216.00,United States,,73576,Technology,Retail: Computer Software & Peripheral Equipment
KTCC,Key Tronic Corporation Common Stock,$6.61,0.12,1.849%,71135967.00,United States,1983,152412,Technology,Computer peripheral equipment
KTOS,Kratos Defense & Security Solutions Inc. Common Stock,$12.05,-0.27,-2.192%,1517781693.00,United States,,686719,Consumer Discretionary,Ordnance And Accessories
KTRA,Kintara Therapeutics Inc. Common Stock,$6.84,-0.15,-2.146%,11054439.00,United States,,10548,Health Care,Biotechnology: Pharmaceutical Preparations
KTTA,Pasithea Therapeutics Corp. Common Stock,$0.678,-0.048,-6.612%,19830610.00,United States,2021,99815,Health Care,Biotechnology: Pharmaceutical Preparations
KTTAW,Pasithea Therapeutics Corp. Warrant,$0.045,0.00,0.00%,0.00,United States,2021,1200,Health Care,Biotechnology: Pharmaceutical Preparations
KURA,Kura Oncology Inc. Common Stock,$13.38,-0.34,-2.478%,913854000.00,United States,,548754,Health Care,Biotechnology: Biological Products (No Diagnostic Substances)
KVHI,KVH Industries Inc. Common Stock,$10.05,0.09,0.904%,192778658.00,United States,1996,13782,Technology,Radio And Television Broadcasting And Communications Equipment
KVSA,Khosla Ventures Acquisition Co. Class A Common Stock,$10.085,-0.005,-0.05%,408341650.00,United States,2021,7216,Industrials,Consumer Electronics/Appliances
KVSC,Khosla Ventures Acquisition Co. III Class A Common Stock,$10.075,0.005,0.05%,632275012.00,United States,2021,233248,Industrials,Consumer Electronics/Appliances
KWE,KWESST Micro Systems Inc. Common Stock,$2.865,-0.035,-1.207%,11668394.00,Canada,,4830,,
KWESW,KWESST Micro Systems Inc. Warrant,$0.40,-0.099,-19.84%,0.00,Canada,,599,,
KXIN,Kaixin Auto Holdings Ordinary Shares,$0.4111,-0.0089,-2.119%,81108054.00,China,2017,163396,Finance,Business Services
KYCH,Keyarch Acquisition Corporation Ordinary Shares,$10.22,-0.01,-0.098%,154526400.00,United States,2022,4700,Finance,Business Services
KYCHR,Keyarch Acquisition Corporation Rights,$0.10,0.00,0.00%,0.00,United States,2022,5,Finance,Business Services
KYMR,Kymera Therapeutics Inc. Common Stock,$37.15,-1.60,-4.129%,2038224608.00,United States,2020,638286,Health Care, Medicinal Chemicals and Botanical Products 
KZIA,Kazia Therapeutics Limited American Depositary Shares,$1.01,-0.01,-0.98%,19070415.00,Australia,,19655,Health Care,Biotechnology: Pharmaceutical Preparations
KZR,Kezar Life Sciences Inc. Common Stock,$7.10,-0.21,-2.873%,486350000.00,United States,2018,432637,Health Care,Biotechnology: Pharmaceutical Preparations
LAB,Standard BioTools Inc. Common Stock,$2.08,0.04,1.961%,164936601.00,United States,2011,260712,Industrials,Biotechnology: Laboratory Analytical Instruments
LABP,Landos Biopharma Inc. Common Stock,$0.41,-0.03,-6.818%,16504505.00,United States,2021,281947,Health Care, Medicinal Chemicals and Botanical Products 
LAKE,Lakeland Industries Inc. Common Stock,$14.30,0.00,0.00%,104674370.00,United States,1986,26034,,
LAMR,Lamar Advertising Company Class A Common Stock,$109.61,-1.60,-1.439%,11145525147.00,United States,1996,394411,Real Estate,Real Estate Investment Trusts
LANC,Lancaster Colony Corporation Common Stock,$186.28,0.06,0.032%,5132572840.00,United States,,157393,Consumer Staples,Packaged Foods
LAND,Gladstone Land Corporation Common Stock,$19.47,-0.33,-1.667%,675686977.00,United States,1993,207541,Real Estate,Real Estate Investment Trusts
LANDM,Gladstone Land Corporation 5.00% Series D Cumulative Term Preferred Stock,$24.1335,-0.0365,-0.151%,581675415.00,United States,,3861,Real Estate,Real Estate Investment Trusts
LANDO,Gladstone Land Corporation 6.00% Series B Cumulative Redeemable Preferred Stock,$24.0472,-0.1403,-0.58%,0.00,United States,,22216,Real Estate,Real Estate Investment Trusts
LARK,Landmark Bancorp Inc. Common Stock,$23.66,0.91,4.00%,123392294.00,United States,,14871,Finance,Major Banks
LASE,Laser Photonics Corporation Common Stock,$6.90,1.22,21.479%,54361077.00,United States,2022,709330,Industrials,Industrial Machinery/Components
LASR,nLIGHT Inc. Common Stock,$12.99,-0.13,-0.991%,588539242.00,United States,2018,225287,Technology,Semiconductors
