Symbol,Name,Last Sale,Net Change,% Change,Market Cap,Country,IPO Year,Volume,Sector,Industry
CSWI,CSW Industrials Inc. Common Stock,$141.28,-5.68,-3.865%,2186571628.00,United States,,127808,Industrials,Home Furnishings
CSX,CSX Corporation Common Stock,$32.27,-0.37,-1.134%,67844729685.00,United States,,9576970,Industrials,Railroads
CTAQ,Carney Technology Acquisition Corp. II Class A Common Stock,$10.18,0.00,0.00%,521343250.00,United States,2021,62958,Industrials,Consumer Electronics/Appliances
CTAQU,Carney Technology Acquisition Corp. II Units,$10.20,-0.035,-0.342%,0.00,United States,2020,500,Industrials,Consumer Electronics/Appliances
CTAQW,Carney Technology Acquisition Corp. II Warrant,$0.10,0.0299,42.653%,0.00,United States,2021,1000,Industrials,Consumer Electronics/Appliances
CTAS,Cintas Corporation Common Stock,$442.42,-2.39,-0.537%,44958932319.00,United States,1983,398501,Consumer Discretionary,Business Services
CTBI,Community Trust Bancorp Inc. Common Stock,$44.70,0.54,1.223%,800947116.00,United States,,35987,Finance,Major Banks
CTG,Computer Task Group Inc. Common Stock,$7.21,-0.51,-6.606%,113286772.00,United States,,14633,Technology,EDP Services
CTHR,Charles & Colvard Ltd Common Stock,$0.9001,-0.1149,-11.32%,27313494.00,United States,1997,290959,Consumer Discretionary,Consumer Specialties
CTIB,Yunhong CTI Ltd. Common Stock,$1.95,0.03,1.563%,31315227.00,United States,1997,29619,Miscellaneous,Diversified Commercial Services
CTIC,CTI BioPharma Corp. (DE) Common Stock,$5.63,-0.12,-2.087%,714414363.00,United States,1997,2369289,Health Care,Biotechnology: Pharmaceutical Preparations
CTKB,Cytek Biosciences Inc. Common Stock,$13.39,0.15,1.133%,1805686477.00,United States,2021,1017397,Health Care,Biotechnology: Electromedical & Electrotherapeutic Apparatus
CTLP,Cantaloupe Inc. Common Stock,$5.13,-0.07,-1.346%,371714927.00,United States,,158928,Technology,EDP Services
CTMX,CytomX Therapeutics Inc. Common Stock,$2.65,0.06,2.317%,175123573.00,United States,2015,865349,Health Care,Biotechnology: Pharmaceutical Preparations
CTRM,Castor Maritime Inc. Common Shares,$1.30,0.08,6.557%,122993114.00,Cyprus,,1689334,Consumer Discretionary,Marine Transportation
CTRN,Citi Trends Inc. Common Stock,$34.05,-0.64,-1.845%,284530449.00,United States,2005,153816,,
CTSH,Cognizant Technology Solutions Corporation Class A Common Stock,$68.22,-2.44,-3.453%,35059720091.00,United States,1998,7388368,Technology,EDP Services
CTSO,Cytosorbents Corporation Common Stock,$3.56,0.35,10.903%,155343145.00,United States,,305187,Health Care,Medical/Dental Instruments
CTXR,Citius Pharmaceuticals Inc. Common Stock,$1.36,0.00,0.00%,198847137.00,United States,,674437,Health Care,Biotechnology: Pharmaceutical Preparations
CUBA,Herzfeld Caribbean Basin Fund Inc. (The) Common Stock,$4.22,-0.08,-1.86%,28083935.00,United States,,39123,Finance,Investment Managers
CUE,Cue Biopharma Inc. Common Stock,$3.58,0.12,3.468%,154092322.00,United States,2018,255344,Health Care,Biotechnology: Pharmaceutical Preparations
CUEN,Cuentas Inc. Common Stock,$1.335,-0.095,-6.643%,25751795.00,United States,,388045,Technology,Computer Software: Prepackaged Software
CUENW,Cuentas Inc. Warrant,$0.12,-0.09,-42.857%,0.00,United States,,750,Technology,Computer Software: Prepackaged Software
CULL,Cullman Bancorp Inc. Common Stock,$11.78,0.01,0.085%,87241420.00,United States,2021,981,Finance,Savings Institutions
CURI,CuriosityStream Inc. Class A Common Stock,$1.73,0.01,0.581%,91354579.00,United States,2020,107276,Industrials,Broadcasting
CURIW,CuriosityStream Inc. Warrant,$0.10,0.00,0.00%,0.00,United States,2020,11069,Industrials,Broadcasting
CUTR,Cutera Inc. Common Stock,$36.23,0.03,0.083%,710668768.00,United States,2004,310456,Health Care,Biotechnology: Electromedical & Electrotherapeutic Apparatus
CVAC,CureVac N.V. Ordinary Shares,$11.06,-0.62,-5.308%,2104532590.00,Germany,2020,537143,Health Care,Biotechnology: Pharmaceutical Preparations
CVBF,CVB Financial Corporation Common Stock,$25.47,0.13,0.513%,3561182365.00,United States,,906527,Finance,Major Banks
CVCO,Cavco Industries Inc. Common Stock When Issued,$274.02,-4.09,-1.471%,2441337073.00,United States,,152437,Consumer Discretionary,Homebuilding
CVCY,Central Valley Community Bancorp Common Stock,$25.65,-0.04,-0.156%,301010214.00,United States,,27613,Finance,Major Banks
CVGI,Commercial Vehicle Group Inc. Common Stock,$8.49,-0.24,-2.749%,283345107.00,United States,2004,162781,Consumer Discretionary,Auto Parts:O.E.M.
CVGW,Calavo Growers Inc. Common Stock,$32.72,-0.27,-0.818%,580179948.00,United States,,95654,Consumer Discretionary,Specialty Foods
CVKD,Cadrenal Therapeutics Inc. Common Stock,$2.40,-0.17,-6.615%,27922980.00,United States,2023,141374,Health Care, Medicinal Chemicals and Botanical Products 
CVLG,Covenant Logistics Group Inc. Class A Common Stock,$34.56,-0.79,-2.235%,466362662.00,United States,,80459,Industrials,Trucking Freight/Courier Services
CVLT,Commvault Systems Inc. Common Stock,$64.64,-1.33,-2.016%,2879925635.00,United States,2006,447339,Technology,Computer Software: Prepackaged Software
CVLY,Codorus Valley Bancorp Inc Common Stock,$24.92,0.42,1.714%,238758520.00,United States,,8090,Finance,Savings Institutions
CVRX,CVRx Inc. Common Stock,$19.40,0.91,4.922%,400294478.00,United States,2021,282833,Health Care,Biotechnology: Electromedical & Electrotherapeutic Apparatus
CVT,Cvent Holding Corp. Common Stock,$7.48,-0.12,-1.579%,3649651324.00,United States,1987,261409,Technology,Computer Software: Prepackaged Software
CVV,CVD Equipment Corporation Common Stock,$13.24,1.58,13.551%,89514819.00,United States,,239419,Technology,Industrial Machinery/Components
CWBC,Community West Bancshares Common Stock,$14.81,0.06,0.407%,130298380.00,United States,,16115,Finance,Major Banks
CWBR,CohBar Inc. Common Stock,$2.73,-0.13,-4.545%,7935908.00,United States,,14782,Health Care,Biotechnology: In Vitro & In Vivo Diagnostic Substances
CWCO,Consolidated Water Co. Ltd. Ordinary Shares,$15.37,0.41,2.741%,240701747.00,Cayman Islands,,70652,Utilities,Water Supply
CWST,Casella Waste Systems Inc. Class A Common Stock,$80.20,-0.26,-0.323%,4144756291.00,United States,1997,247477,Utilities,Environmental Services
CXDO,Crexendo Inc. Common Stock,$1.76,-0.02,-1.124%,44383161.00,United States,,22798,Consumer Discretionary,Telecommunications Equipment
CYAD,Celyad Oncology SA American Depositary Shares,$1.24,-0.02,-1.587%,28016505.00,Belgium,2015,37803,Health Care,Biotechnology: Pharmaceutical Preparations
CYAN,Cyanotech Corporation Common Stock,$1.35,-0.03,-2.174%,8467161.00,United States,,1492,Consumer Staples,Farming/Seeds/Milling
CYBR,CyberArk Software Ltd. Ordinary Shares,$146.01,-2.76,-1.855%,5944991197.00,Israel,2014,494760,Technology,Computer Software: Prepackaged Software
CYCC,Cyclacel Pharmaceuticals Inc. Common Stock,$1.06,-0.03,-2.752%,13291540.00,United States,,123119,Health Care,Biotechnology: Pharmaceutical Preparations
CYCCP,Cyclacel Pharmaceuticals Inc. 6% Convertible Preferred Stock,$16.00,-0.30,-1.84%,0.00,United States,,4704,Health Care,Biotechnology: Pharmaceutical Preparations
CYCN,Cyclerion Therapeutics Inc. Common Stock,$0.683,-0.0517,-7.037%,29706528.00,United States,,146645,Health Care,Biotechnology: Pharmaceutical Preparations
CYN,Cyngn Inc. Common Stock,$1.24,0.045,3.766%,41764180.00,United States,2021,935854,Technology,EDP Services
CYRN,CYREN Ltd. Ordinary Shares,$0.5351,-0.0244,-4.361%,4280697.00,United States,,371055,Technology,Computer Software: Prepackaged Software
CYRX,CryoPort Inc. Common Stock,$25.24,-0.62,-2.398%,1236755936.00,United States,,394049,,
CYT,Cyteir Therapeutics Inc. Common Stock,$1.69,0.07,4.321%,59891761.00,United States,2021,92073,Health Care,Biotechnology: Pharmaceutical Preparations
CYTH,Cyclo Therapeutics Inc. Common Stock,$1.75,-0.11,-5.914%,17171952.00,United States,,140407,Health Care,Biotechnology: Pharmaceutical Preparations
CYTHW,Cyclo Therapeutics Inc. Warrant,$0.31,0.00,0.00%,0.00,United States,,31,Health Care,Biotechnology: Pharmaceutical Preparations
CYTK,Cytokinetics Incorporated Common Stock,$45.01,0.45,1.01%,4259341355.00,United States,2004,998325,Health Care,Biotechnology: Pharmaceutical Preparations
CYTO,Altamira Therapeutics Ltd. 0.2 Common Shares (Bermuda),$2.96,-0.03,-1.003%,3836435.00,Bermuda,2014,22401,Health Care,Biotechnology: Pharmaceutical Preparations
CYXT,Cyxtera Technologies Inc. Class A Common Stock,$2.83,0.08,2.909%,508317545.00,United States,2020,779131,Technology,EDP Services
CZFS,Citizens Financial Services Inc. Common Stock,$83.00,0.50,0.606%,329610347.00,United States,,2169,Finance,Major Banks
CZNC,Citizens & Northern Corp Common Stock,$23.36,-0.08,-0.341%,362519612.00,United States,,23455,Finance,Major Banks
CZR,Caesars Entertainment Inc. Common Stock,$54.99,1.24,2.307%,11798990114.00,United States,,4660436,Consumer Discretionary,Hotels/Resorts
CZWI,Citizens Community Bancorp Inc. Common Stock,$12.54,0.03,0.24%,130730992.00,United States,2006,14445,Finance,Savings Institutions
DADA,Dada Nexus Limited American Depositary Shares,$12.93,-1.00,-7.179%,3304767128.00,China,2020,1580807,Consumer Discretionary,Department/Specialty Retail Stores
DAIO,Data I/O Corporation Common Stock,$4.28,0.045,1.063%,37734111.00,United States,1981,13067,Technology,Industrial Machinery/Components
DAKT,Daktronics Inc. Common Stock,$4.10,-0.04,-0.966%,186409485.00,United States,1994,256834,Industrials,Office Equipment/Supplies/Services
DALN,DallasNews Corporation Series A Common Stock,$5.39,0.16,3.059%,28849921.00,United States,,71758,Consumer Discretionary,Newspapers/Magazines
DALS,DA32 Life Science Tech Acquisition Corp. Class A Common Stock,$10.08,0.00,0.00%,258552000.00,United States,2021,172,Industrials,Consumer Electronics/Appliances
DARE,Dare Bioscience Inc. Common Stock,$1.25,-0.01,-0.794%,106000000.00,United States,2014,165171,Health Care,Biotechnology: Pharmaceutical Preparations
DATS,DatChat Inc. Common Stock,$0.6562,-0.0511,-7.225%,13516026.00,United States,2021,173485,Technology,Computer Software: Prepackaged Software
DATSW,DatChat Inc. Series A Warrant,$0.1247,0.0281,29.089%,0.00,United States,2021,2600,Technology,Computer Software: Prepackaged Software
DAVE,Dave Inc. Class A Common Stock,$9.80,0.05,0.513%,115795212.00,United States,,31324,Technology,Retail: Computer Software & Peripheral Equipment
DAVEW,Dave Inc. Warrants,$0.052,0.0078,17.647%,0.00,United States,,56293,Technology,Retail: Computer Software & Peripheral Equipment
DAWN,Day One Biopharmaceuticals Inc. Common Stock,$21.11,-0.64,-2.943%,1552630494.00,United States,2021,433904,Health Care,Biotechnology: Pharmaceutical Preparations
DBGI,Digital Brands Group Inc. Common Stock,$3.05,0.06,2.007%,6619985.00,United States,2021,1165637,Consumer Discretionary,Apparel
DBGIW,Digital Brands Group Inc. Warrant,$1.81,-0.10,-5.236%,0.00,United States,2021,304,Consumer Discretionary,Apparel
DBTX,Decibel Therapeutics Inc. Common Stock,$3.25,-0.04,-1.216%,81134632.00,United States,2021,108092,Health Care,Biotechnology: Pharmaceutical Preparations
DBVT,DBV Technologies S.A. American Depositary Shares,$1.40,-0.05,-3.448%,263107295.00,France,2014,78818,Health Care,Biotechnology: Pharmaceutical Preparations
DBX,Dropbox Inc. Class A Common Stock,$24.06,-0.28,-1.15%,8727437255.00,United States,2018,2400470,Technology,Computer Software: Prepackaged Software
DCBO,Docebo Inc. Common Shares,$40.28,0.95,2.415%,1325472370.00,Canada,,91843,,
DCFC,Tritium DCFC Limited Ordinary Shares,$1.50,0.02,1.351%,233233284.00,Australia,,2311709,Technology,Electronic Components
DCFCW,Tritium DCFC Limited Warrant,$0.4389,-0.0212,-4.608%,0.00,Australia,,35366,Technology,Electronic Components
DCGO,DocGo Inc. Common Stock,$10.08,-0.02,-0.198%,1032304513.00,United States,2020,412432,Health Care,Managed Health Care
DCOM,Dime Community Bancshares Inc. Common Stock,$31.70,0.81,2.622%,1222785244.00,United States,,174458,Finance,Savings Institutions
DCOMP,Dime Community Bancshares Inc. Fixed-Rate Non-Cumulative Perpetual Preferred Stock Series A,$21.88,-0.06,-0.273%,0.00,United States,,3829,Finance,Savings Institutions
DCPH,Deciphera Pharmaceuticals Inc. Common Stock,$17.03,-0.52,-2.963%,1287867558.00,United States,2017,800796,Health Care,Biotechnology: Pharmaceutical Preparations
DCRD,Decarbonization Plus Acquisition Corporation IV Class A Ordinary Share,$10.23,-0.03,-0.292%,404404688.00,United States,2021,357965,Finance,Business Services
DCRDU,Decarbonization Plus Acquisition Corporation IV Unit,$11.03,0.24,2.224%,0.00,United States,2021,7176,Finance,Business Services
DCRDW,Decarbonization Plus Acquisition Corporation IV Warrant,$0.67,-0.04,-5.634%,0.00,United States,2021,293865,Finance,Business Services
DCT,Duck Creek Technologies Inc. Common Stock,$18.91,-0.01,-0.053%,2512916032.00,United States,2020,1972175,Technology,Retail: Computer Software & Peripheral Equipment
DCTH,Delcath Systems Inc. Common Stock,$3.66,0.15,4.274%,36770450.00,United States,,35369,Health Care,Medical Specialities
DDI,DoubleDown Interactive Co. Ltd. American Depository Shares,$9.30,-0.39,-4.025%,460846992.00,South Korea,2021,44191,Technology,EDP Services
DDOG,Datadog Inc. Class A Common Stock,$79.46,-7.51,-8.635%,25233304727.00,United States,2019,7029862,Technology,EDP Services
DECA,Denali Capital Acquisition Corp. Class A Ordinary Shares,$10.35,-0.01,-0.097%,112012875.00,United States,2022,62240,Finance,Business Services
DECAW,Denali Capital Acquisition Corp. Warrant,$0.06,-0.0001,-0.166%,0.00,United States,2022,125,Finance,Business Services
DENN,Denny's Corporation Common Stock,$12.50,0.02,0.16%,715415925.00,United States,,474888,Consumer Discretionary,Restaurants
DERM,Journey Medical Corporation Common Stock,$2.45,0.21,9.375%,43525965.00,United States,2021,25157,Health Care,Biotechnology: Pharmaceutical Preparations
DFFN,Diffusion Pharmaceuticals Inc. Common Stock,$6.21,0.05,0.812%,12664935.00,United States,,7524,Health Care,Biotechnology: Pharmaceutical Preparations
DFLI,Dragonfly Energy Holdings Corp. Common Stock,$6.90,-0.05,-0.719%,298581823.00,United States,2021,30840,Technology,Electronic Components
DFLIW,Dragonfly Energy Holdings Corp. Warrant,$0.4574,0.1174,34.529%,0.00,United States,2021,1080,Technology,Electronic Components
DGHI,Digihost Technology Inc. Common Subordinate Voting Shares,$1.80,-0.13,-6.736%,50081063.00,Canada,,193048,,
DGICA,Donegal Group Inc. Class A Common Stock,$15.39,0.10,0.654%,499683690.00,United States,,24588,Finance,Property-Casualty Insurers
DGICB,Donegal Group Inc. Class B Common Stock,$16.09,0.14,0.878%,522411343.00,United States,1986,2966,Finance,Property-Casualty Insurers
DGII,Digi International Inc. Common Stock,$35.21,-1.24,-3.402%,1255819331.00,United States,1989,299504,Technology,Computer peripheral equipment
DGLY,Digital Ally Inc. Common Stock,$0.3455,-0.0034,-0.974%,18623626.00,United States,,248219,Technology,Security Systems Services
DGNU,Dragoneer Growth Opportunities Corp. III Class A Ordinary Shares,$9.89,0.01,0.101%,532423284.00,United States,2021,250845,Finance,Business Services
DH,Definitive Healthcare Corp. Class A Common Stock,$13.12,-0.63,-4.582%,1378650413.00,United States,2021,521385,Technology,Computer Software: Prepackaged Software
DHAC,Digital Health Acquisition Corp. Common Stock,$10.96,0.25,2.334%,45222308.00,United States,2021,33346,Industrials,Consumer Electronics/Appliances
DHACU,Digital Health Acquisition Corp. Unit,$10.8801,0.00,0.00%,0.00,United States,2021,12,Industrials,Consumer Electronics/Appliances
DHACW,Digital Health Acquisition Corp. Warrant,$0.1175,-0.0027,-2.246%,0.00,United States,2021,7955,Industrials,Consumer Electronics/Appliances
DHC,Diversified Healthcare Trust Common Shares of Beneficial Interest,$0.745,0.0186,2.561%,178579227.00,United States,,3239277,Real Estate,Real Estate Investment Trusts
DHCA,DHC Acquisition Corp. Class A ordinary share,$10.165,-0.005,-0.049%,393195821.00,United States,2021,178245,Finance,Business Services
DHCAU,DHC Acquisition Corp. Unit,$10.15,0.00,0.00%,0.00,United States,2021,59,Finance,Business Services
DHCAW,DHC Acquisition Corp. Warrant,$0.02,0.00,0.00%,0.00,United States,2021,5001,Finance,Business Services
DHCNI,Diversified Healthcare Trust 5.625% Senior Notes due 2042,$12.39,0.15,1.225%,0.00,United States,,52734,Real Estate,Real Estate Investment Trusts
DHCNL,Diversified Healthcare Trust 6.25% Senior Notes Due 2046,$13.65,0.10,0.738%,0.00,United States,,54631,Real Estate,Real Estate Investment Trusts
DHHC,DiamondHead Holdings Corp. Class A Common Stock,$10.14,0.01,0.099%,437287500.00,United States,2021,485,Industrials,Consumer Electronics/Appliances
DHHCU,DiamondHead Holdings Corp. Unit,$10.34,0.00,0.00%,0.00,United States,2021,51,Industrials,Consumer Electronics/Appliances
DHHCW,DiamondHead Holdings Corp. Warrant,$0.1896,-0.0803,-29.752%,0.00,United States,2021,8700,Industrials,Consumer Electronics/Appliances
DHIL,Diamond Hill Investment Group Inc. Class A Common Stock,$189.00,1.19,0.634%,569996595.00,United States,,15344,Finance,Investment Managers
DIBS,1stdibs.com Inc. Common Stock,$6.26,-0.08,-1.262%,243706614.00,United States,2021,113608,Miscellaneous,Diversified Commercial Services
DICE,DICE Therapeutics Inc. Common Stock,$31.20,0.98,3.243%,1487081856.00,United States,2021,338648,Health Care,Biotechnology: Pharmaceutical Preparations
DIOD,Diodes Incorporated Common Stock,$94.18,-1.29,-1.351%,4282337570.00,United States,,204516,Technology,Semiconductors
DISA,Disruptive Acquisition Corporation I Class A Ordinary Shares,$10.16,-0.01,-0.098%,349250000.00,United States,2021,2432,Finance,Business Services
DISAU,Disruptive Acquisition Corporation I Unit,$10.17,0.00,0.00%,0.00,United States,2021,1,Finance,Business Services
DISAW,Disruptive Acquisition Corporation I Warrant,$0.04,0.0087,27.796%,0.00,United States,2021,6000,Finance,Business Services
DISH,DISH Network Corporation Class A Common Stock,$15.08,-0.52,-3.333%,8003053583.00,United States,1995,2989066,Consumer Discretionary,Telecommunications Equipment
DJCO,Daily Journal Corp. (S.C.) Common Stock,$309.00,-4.49,-1.432%,425501034.00,United States,,1151,Technology,Retail: Computer Software & Peripheral Equipment
DKDCA,Data Knights Acquisition Corp. Class A Common Stock,$10.61,0.02,0.189%,158727457.00,United Kingdom,2021,977,Industrials,Consumer Electronics/Appliances
DKDCU,Data Knights Acquisition Corp. Unit,$10.50,0.01,0.095%,0.00,United Kingdom,2021,800,Industrials,Consumer Electronics/Appliances
DKDCW,Data Knights Acquisition Corp. Warrant,$0.036,-0.0015,-4.00%,0.00,United Kingdom,2021,350,Industrials,Consumer Electronics/Appliances
DKNG,DraftKings Inc. Class A Common Stock,$16.87,-0.15,-0.881%,7572069724.00,United States,2019,15694518,Consumer Discretionary,Services-Misc. Amusement & Recreation
DLHC,DLH Holdings Corp.,$12.78,0.19,1.509%,175814064.00,United States,,31686,Consumer Discretionary,Business Services
DLO,DLocal Limited Class A Common Shares,$16.74,-0.40,-2.334%,4954790423.00,Uruguay,2021,1088342,Consumer Discretionary,Business Services
DLPN,Dolphin Entertainment Inc. Common Stock,$2.26,0.02,0.893%,23083758.00,United States,,44616,Consumer Discretionary,Advertising
DLTH,Duluth Holdings Inc. Class B Common Stock,$6.92,-0.01,-0.144%,231285119.00,United States,2015,83275,Consumer Discretionary,Department/Specialty Retail Stores
DLTR,Dollar Tree Inc. Common Stock,$149.91,-7.11,-4.528%,33157765247.00,United States,1995,4287716,Consumer Discretionary,Department/Specialty Retail Stores
DMAC,DiaMedica Therapeutics Inc. Common Stock,$1.35,-0.01,-0.735%,35698140.00,United States,2018,67401,Health Care,Pharmaceuticals and Biotechnology
DMAQ,Deep Medicine Acquisition Corp. Class A Common Stock,$10.27,0.02,0.195%,168768964.00,United States,2021,123,Industrials,Consumer Electronics/Appliances
DMAQR,Deep Medicine Acquisition Corp. Rights,$0.10,0.0001,0.10%,0.00,United States,2021,150,,
DMLP,Dorchester Minerals L.P. Common Units Representing Limited Partnership Interests,$28.41,-0.62,-2.136%,1090134116.00,United States,,112078,Energy,Oil & Gas Production
DMRC,Digimarc Corporation Common Stock,$21.62,-0.38,-1.727%,433177347.00,United States,,56559,Technology,EDP Services
DMTK,DermTech Inc. Common Stock,$5.57,0.05,0.906%,168295907.00,United States,2017,368670,Health Care,Managed Health Care
DNAB,Social Capital Suvretta Holdings Corp. II Class A Ordinary Shares,$10.1181,0.0081,0.08%,322666209.00,United States,2021,315067,Finance,Business Services
DNAD,Social Capital Suvretta Holdings Corp. IV Class A Ordinary Shares,$10.12,0.01,0.099%,322726800.00,United States,2021,83917,Finance,Business Services
DNLI,Denali Therapeutics Inc. Common Stock,$31.70,-0.97,-2.969%,4305293276.00,United States,2017,517946,Health Care,Biotechnology: Biological Products (No Diagnostic Substances)
DNUT,Krispy Kreme Inc. Common Stock,$12.81,-0.03,-0.234%,2144869546.00,United States,2021,475555,Consumer Discretionary,Specialty Foods
DOCU,DocuSign Inc. Common Stock,$65.33,-2.50,-3.686%,13136174089.00,United States,2018,3994808,Technology,EDP Services
DOGZ,Dogness (International) Corporation Class A Common Stock,$1.045,0.0515,5.184%,41041601.00,China,2017,177473,Consumer Discretionary,Miscellaneous manufacturing industries
DOMH,Dominari Holdings Inc. Common Stock,$3.82,0.00,0.00%,20953067.00,United States,,23630,Health Care, Medicinal Chemicals and Botanical Products 
DOMO,Domo Inc. Class B Common Stock,$16.81,-1.87,-10.011%,580700878.00,United States,2018,1002973,Technology,Computer Software: Prepackaged Software
DOOO,BRP Inc. (Recreational Products) Common Subordinate Voting Shares,$89.58,0.89,1.003%,7054018934.00,Canada,,61065,,
DORM,Dorman Products Inc. Common Stock,$99.87,-1.81,-1.78%,3137773085.00,United States,,110452,Consumer Discretionary,Auto Parts:O.E.M.
DOX,Amdocs Limited Ordinary Shares,$92.82,-1.44,-1.528%,11214196998.00,Guernsey,,654480,Technology,EDP Services
DOYU,DouYu International Holdings Limited ADS,$1.76,-0.18,-9.278%,558771558.00,China,2019,1847184,Technology,Computer Software: Programming Data Processing
DPCS,DP Cap Acquisition Corp I Class A Ordinary Shares,$10.33,0.00,0.00%,296987500.00,United States,2021,1,Finance,Business Services
DPCSW,DP Cap Acquisition Corp I Warrants,$0.0816,0.0006,0.741%,0.00,United States,2021,306,Finance,Business Services
DPRO,Draganfly Inc. Common Shares,$1.91,-0.03,-1.546%,64560924.00,Canada,,928539,Consumer Discretionary,Electronic Components
DRCT,Direct Digital Holdings Inc. Class A Common Stock,$5.54,0.51,10.139%,78546120.00,United States,2022,334423,Consumer Discretionary,Advertising
DRCTW,Direct Digital Holdings Inc. Warrant,$1.65,0.45,37.50%,0.00,United States,2022,9066,Consumer Discretionary,Advertising
DRIO,DarioHealth Corp. Common Stock,$5.13,-0.21,-3.933%,131735373.00,Israel,,138955,Health Care,Medical/Dental Instruments
DRMA,Dermata Therapeutics Inc. Common Stock,$0.3029,0.0026,0.866%,3732288.00,United States,2021,329609,Health Care,Biotechnology: Pharmaceutical Preparations
DRMAW,Dermata Therapeutics Inc. Warrant,$0.0473,-0.0026,-5.21%,0.00,United States,2021,203,Health Care,Biotechnology: Pharmaceutical Preparations
DRRX,DURECT Corporation Common Stock,$6.40,-0.02,-0.312%,145830291.00,United States,2000,37365,Health Care,Biotechnology: Pharmaceutical Preparations
DRS,Leonardo DRS Inc. Common Stock,$13.31,0.06,0.453%,3463092431.00,Israel,,638897,Industrials,Military/Government/Technical
DRTS,Alpha Tau Medical Ltd. Ordinary Shares,$3.82,-0.17,-4.261%,263624121.00,Israel,,34312,Health Care,Medical/Dental Instruments
DRTSW,Alpha Tau Medical Ltd. Warrant,$0.4275,0.0075,1.786%,0.00,Israel,,1001,Health Care,Medical/Dental Instruments
DRTT,DIRTT Environmental Solutions Ltd. Common Shares,$0.6125,0.0116,1.93%,59646714.00,Canada,,122459,,
DRUG,Bright Minds Biosciences Inc. Common Stock,$0.752,-0.009,-1.183%,14070190.00,Canada,,141558,Health Care,Pharmaceuticals and Biotechnology
DRVN,Driven Brands Holdings Inc. Common Stock,$29.17,-0.69,-2.311%,4883176051.00,United States,2021,404011,,
DSEY,Diversey Holdings Ltd. Ordinary Shares,$6.22,-0.16,-2.508%,2017245290.00,United States,2021,385985,Consumer Discretionary,Specialty Chemicals
DSGN,Design Therapeutics Inc. Common Stock,$8.01,-0.19,-2.317%,447839669.00,United States,2021,301803,Health Care,Biotechnology: Pharmaceutical Preparations
DSGR,Distribution Solutions Group Inc. Common Stock,$45.05,0.17,0.379%,888031772.00,United States,,22593,Industrials,Industrial Machinery/Components
DSGX,Descartes Systems Group Inc. (The) Common Stock,$76.29,0.82,1.087%,6470764762.00,Canada,,84870,,
DSKE,Daseke Inc. Common Stock,$7.52,0.07,0.94%,337460684.00,United States,2015,356395,,
DSP,Viant Technology Inc. Class A Common Stock,$4.54,-0.05,-1.089%,65648781.00,United States,2021,97779,Technology,EDP Services
DSWL,Deswell Industries Inc. Common Shares,$3.14,0.00,0.00%,50036650.00,Macau,1995,663,Industrials,Plastic Products
DTEA,DAVIDsTEA Inc. Common Stock,$1.11,0.1301,13.277%,29493849.00,Canada,2015,101922,,
DTIL,Precision BioSciences Inc. Common Stock,$1.22,0.01,0.826%,135369925.00,United States,2019,459939,Health Care,Biotechnology: Pharmaceutical Preparations
DTOC,Digital Transformation Opportunities Corp. Class A Common Stock,$10.13,0.01,0.099%,422294375.00,United States,2021,38356,Industrials,Consumer Electronics/Appliances
DTOCU,Digital Transformation Opportunities Corp. Units,$10.12,0.00,0.00%,0.00,United States,2021,154708,Industrials,Consumer Electronics/Appliances
DTOCW,Digital Transformation Opportunities Corp. Warrant,$0.0422,-0.0428,-50.353%,0.00,United States,2021,1990,Industrials,Consumer Electronics/Appliances
DTSS,Datasea Inc. Common Stock,$1.395,-0.015,-1.064%,33932863.00,China,,14966,Technology,Retail: Computer Software & Peripheral Equipment
DTST,Data Storage Corporation Common Stock,$1.82,-0.05,-2.674%,12416271.00,United States,,17293,Technology,EDP Services
DTSTW,Data Storage Corporation Warrant,$0.1989,0.0089,4.684%,0.00,United States,,600,Technology,EDP Services
