Symbol,Name,Last Sale,Net Change,% Change,Market Cap,Country,IPO Year,Volume,Sector,Industry
RDIB,Reading International Inc Class B Common Stock,$20.55,0.35,1.733%,453000583.00,United States,,922,Consumer Discretionary,Movies/Entertainment
RDNT,RadNet Inc. Common Stock,$21.55,-0.11,-0.508%,1236126318.00,United States,,211665,Health Care,Medical Specialities
RDVT,Red Violet Inc. Common Stock ,$24.07,0.08,0.333%,334423838.00,United States,,12891,Technology,Computer Software: Prepackaged Software
RDWR,Radware Ltd. Ordinary Shares,$22.14,-0.52,-2.295%,992774626.00,Israel,1999,90277,Consumer Discretionary,Business Services
REAL,The RealReal Inc. Common Stock,$2.08,-0.18,-7.965%,203976822.00,United States,2019,3892875,Consumer Discretionary,Consumer Specialties
REAX,The Real Brokerage Inc. Common Shares,$1.36,0.01,0.741%,243238498.00,Canada,,143771,,
REBN,Reborn Coffee Inc. Common Stock,$1.0612,-0.0088,-0.822%,13922438.00,United States,2022,77229,Consumer Discretionary,Restaurants
REE,REE Automotive Ltd. Class A Ordinary Shares,$0.5124,-0.0326,-5.982%,124897798.00,Israel,,455081,Consumer Discretionary,Auto Manufacturing
REED,Reeds Inc. Common Stock,$4.17,0.13,3.218%,10511723.00,United States,,67857,Consumer Staples,Beverages (Production/Distribution)
REFI,Chicago Atlantic Real Estate Finance Inc. Common Stock,$15.40,0.00,0.00%,271931860.00,United States,2021,18183,Real Estate,Real Estate Investment Trusts
REFR,Research Frontiers Incorporated Common Stock,$2.11,0.01,0.476%,69947336.00,United States,,14687,Technology,Industrial Machinery/Components
REG,Regency Centers Corporation Common Stock,$66.81,-0.72,-1.066%,11432708923.00,United States,1993,644779,Real Estate,Real Estate Investment Trusts
REGN,Regeneron Pharmaceuticals Inc. Common Stock,$783.13,31.93,4.251%,85284372357.00,United States,1991,1448450,Health Care,Biotechnology: Pharmaceutical Preparations
REKR,Rekor Systems Inc. Common Stock,$1.81,0.04,2.26%,98369067.00,United States,,312431,Technology,EDP Services
RELI,Reliance Global Group Inc. Common Stock,$0.6693,0.0543,8.829%,12083856.00,United States,,397589,Finance,Specialty Insurers
RELIW,Reliance Global Group Inc. Series A Warrants,$0.142,0.00,0.00%,0.00,United States,,50,Finance,Specialty Insurers
RELL,Richardson Electronics Ltd. Common Stock,$24.02,0.38,1.607%,338073910.00,United States,1983,157498,Technology,Electronic Components
RELY,Remitly Global Inc. Common Stock,$13.00,0.38,3.011%,2218629439.00,United States,2021,767938,Technology,Computer Software: Prepackaged Software
RENE,Cartesian Growth Corporation II Class A Ordinary Shares,$10.355,0.00,0.00%,297706250.00,United States,2022,1160,Finance,Business Services
RENEW,Cartesian Growth Corporation II Warrant,$0.111,0.00,0.00%,0.00,United States,2022,1,Finance,Business Services
RENT,Rent the Runway Inc. Class A Common Stock,$4.54,0.04,0.889%,295203453.00,United States,2021,740389,Consumer Discretionary,Department/Specialty Retail Stores
REPL,Replimune Group Inc. Common Stock,$28.29,-0.80,-2.75%,1559172033.00,United States,2018,232865,Health Care,Biotechnology: Pharmaceutical Preparations
RETA,Reata Pharmaceuticals Inc. Class A Common Stock,$48.87,-0.63,-1.273%,1790775420.00,United States,2016,893250,Health Care,Biotechnology: Pharmaceutical Preparations
RETO,ReTo Eco-Solutions Inc. Common Shares,$0.46,-0.02,-4.167%,19829732.00,China,2017,29113,Consumer Discretionary,Multi-Sector Companies
REUN,Reunion Neuroscience Inc. Common Shares,$1.26,-0.0047,-0.372%,14671563.00,Canada,,20769,Health Care,Pharmaceuticals and Biotechnology
REVB,Revelation Biosciences Inc. Common Stock,$9.10,0.72,8.592%,6119377.00,United States,2020,183883,Health Care,Biotechnology: Pharmaceutical Preparations
REVBW,Revelation Biosciences Inc. Warrant,$0.0317,0.0017,5.667%,0.00,United States,2020,151628,Health Care,Biotechnology: Pharmaceutical Preparations
REVE,Alpine Acquisition Corporation Common Stock,$10.51,0.00,0.00%,142410500.00,United States,2021,8065,Industrials,Consumer Electronics/Appliances
REVEU,Alpine Acquisition Corporation Unit,$10.52,0.01,0.095%,0.00,United States,2021,100,Industrials,Consumer Electronics/Appliances
REVEW,Alpine Acquisition Corporation Warrant,$0.09,0.00,0.00%,0.00,United States,2021,1,Industrials,Consumer Electronics/Appliances
REYN,Reynolds Consumer Products Inc. Common Stock,$30.00,0.48,1.626%,6295879740.00,United States,2020,273796,Industrials,Office Equipment/Supplies/Services
RFAC,RF Acquisition Corp. Class A Common Stock,$10.21,0.01,0.098%,148810750.00,Singapore,2022,444,Industrials,Consumer Electronics/Appliances
RFACU,RF Acquisition Corp. Unit,$10.27,0.03,0.293%,0.00,Singapore,2022,100,Industrials,Consumer Electronics/Appliances
RFACW,RF Acquisition Corp. Warrants,$0.02,0.00,0.00%,0.00,Singapore,2022,100,Industrials,Consumer Electronics/Appliances
RFIL,RF Industries Ltd. Common Stock,$5.34,0.08,1.521%,54432153.00,United States,,3407,Technology,Electrical Products
RGC,Regencell Bioscience Holdings Limited Ordinary Shares,$29.60,0.00,0.00%,385180834.00,Hong Kong,2021,45,Health Care, Medicinal Chemicals and Botanical Products 
RGCO,RGC Resources Inc. Common Stock,$24.00,0.165,0.692%,237857544.00,United States,,10844,Utilities,Oil & Gas Production
RGEN,Repligen Corporation Common Stock,$192.91,-2.27,-1.163%,10711219527.00,United States,1986,350811,Health Care,Medical/Dental Instruments
RGF,The Real Good Food Company Inc. Class A Common Stock,$5.38,-0.14,-2.536%,138521905.00,United States,2021,39100,Consumer Discretionary,Food Distributors
RGLD,Royal Gold Inc. Common Stock,$124.49,-3.42,-2.674%,8171985458.00,United States,,468529,Industrials,Consumer Electronics/Appliances
RGLS,Regulus Therapeutics Inc. Common Stock,$1.61,0.03,1.899%,27112820.00,United States,2012,161704,Health Care,Biotechnology: Pharmaceutical Preparations
RGNX,REGENXBIO Inc. Common Stock,$23.75,-0.31,-1.288%,1028223736.00,United States,2015,327093,Health Care,Biotechnology: Biological Products (No Diagnostic Substances)
RGP,Resources Connection Inc. Common Stock,$18.10,0.02,0.111%,608780414.00,United States,,222570,Consumer Discretionary,Business Services
RGTI,Rigetti Computing Inc. Common Stock,$1.05,0.1881,21.824%,129181557.00,United States,,7168838,Technology,Retail: Computer Software & Peripheral Equipment
RGTIW,Rigetti Computing Inc. Warrants,$0.1462,0.0282,23.898%,0.00,United States,,205700,Technology,Retail: Computer Software & Peripheral Equipment
RIBT,RiceBran Technologies Common Stock,$1.11,-0.08,-6.723%,6928705.00,United States,,58197,Consumer Staples,Specialty Foods
RICK,RCI Hospitality Holdings Inc. Common Stock,$93.44,0.58,0.625%,862472224.00,United States,1995,51784,Consumer Discretionary,Restaurants
RIDE,Lordstown Motors Corp. Class A Common Stock,$1.47,0.03,2.083%,337943473.00,United States,2019,4615810,Consumer Discretionary,Construction/Ag Equipment/Trucks
RIGL,Rigel Pharmaceuticals Inc. Common Stock,$1.79,0.02,1.13%,309377041.00,United States,2000,1822336,Health Care,Biotechnology: Pharmaceutical Preparations
RILY,B. Riley Financial Inc. Common Stock,$44.23,-2.34,-5.025%,1258218993.00,United States,,369429,Finance,Investment Managers
RILYG,B. Riley Financial Inc. 5.00% Senior Notes due 2026,$21.96,0.00,0.00%,0.00,United States,,2638,Consumer Discretionary,Business Services
RILYK,B. Riley Financial Inc. 5.50% Senior Notes Due 2026,$22.85,-0.03,-0.131%,0.00,United States,,5324,Consumer Discretionary,Business Services
RILYL,B. Riley Financial Inc. Depositary Shares each representing 1/1000th in a share of 7.375% Series B Cumulative Perpetual Preferred Stock par value $0.0001,$24.81,-0.06,-0.241%,0.00,United States,,2900,Finance,Investment Managers
RILYM,B. Riley Financial Inc. 6.375% Senior Notes due 2025,$24.0859,-0.1041,-0.43%,0.00,United States,,2937,Consumer Discretionary,Business Services
RILYN,B. Riley Financial Inc. 6.50% Senior Notes Due 2026,$23.50,-0.06,-0.255%,0.00,United States,,11060,Consumer Discretionary,Business Services
RILYO,B. Riley Financial Inc. 6.75% Senior Notes due 2024,$24.855,-0.045,-0.181%,0.00,United States,,7932,Consumer Discretionary,Business Services
RILYP,B. Riley Financial Inc. Depositary Shares each representing a 1/1000th fractional interest in a share of Series A Cumulative Perpetual Preferred Stock,$23.25,-0.20,-0.853%,0.00,United States,,2548,Finance,Investment Managers
RILYT,B. Riley Financial Inc. 6.00% Senior Notes Due 2028,$22.375,-0.305,-1.345%,0.00,United States,,6164,Consumer Discretionary,Business Services
RILYZ,B. Riley Financial Inc. 5.25% Senior Notes due 2028,$21.33,-0.22,-1.021%,0.00,United States,,14240,Consumer Discretionary,Business Services
RIOT,Riot Platforms Inc. Common Stock ,$6.84,-0.65,-8.678%,1144310871.00,United States,,18902906,Technology,Retail: Computer Software & Peripheral Equipment
RIVN,Rivian Automotive Inc. Class A Common Stock,$19.90,-0.98,-4.693%,18327020520.00,United States,2021,27113709,Consumer Discretionary,Auto Manufacturing
RKDA,Arcadia Biosciences Inc. Common Stock,$0.29,0.006,2.113%,7146458.00,United States,2015,397494,Consumer Staples,Farming/Seeds/Milling
RKLB,Rocket Lab USA Inc. Common Stock,$5.31,0.07,1.336%,2512995684.00,United States,2020,6142686,Industrials,Aerospace
RLAY,Relay Therapeutics Inc. Common Stock,$22.07,-0.69,-3.032%,2668150465.00,United States,2020,721507,Health Care,Biotechnology: Pharmaceutical Preparations
RLMD,Relmada Therapeutics Inc. Common Stock,$4.12,-0.15,-3.513%,124008716.00,United States,,246865,Health Care,Biotechnology: Pharmaceutical Preparations
RLYB,Rallybio Corporation Common Stock,$6.45,-0.33,-4.867%,244056951.00,United States,2021,81416,Health Care,Biotechnology: Pharmaceutical Preparations
RMBI,Richmond Mutual Bancorporation Inc. Common Stock,$13.26,0.1318,1.004%,156255840.00,United States,2019,8891,,
RMBL,RumbleOn Inc. Class B Common Stock,$9.11,-0.27,-2.878%,147524470.00,United States,,108581,Consumer Discretionary,Automotive Aftermarket
RMBS,Rambus Inc. Common Stock,$43.62,-0.72,-1.624%,4688365276.00,United States,1997,1938215,Technology,Semiconductors
RMCF,Rocky Mountain Chocolate Factory Inc. Common Stock,$5.35,-0.02,-0.372%,33439089.00,United States,,162976,Consumer Staples,Specialty Foods
RMGC,RMG Acquisition Corp. III Class A Ordinary Shares,$10.04,0.04,0.40%,606165000.00,United States,2021,854,Finance,Business Services
RMGCU,RMG Acquisition Corp. III Unit,$9.99,-0.03,-0.299%,0.00,United States,2021,1638,Finance,Business Services
RMGCW,RMG Acquisition Corp. III Warrant,$0.1101,0.00,0.00%,0.00,United States,2021,392,Finance,Business Services
RMNI,Rimini Street Inc. (DE) Common Stock,$5.05,-0.05,-0.98%,445803900.00,United States,2015,161757,Technology,EDP Services
RMR,The RMR Group Inc. Class A Common Stock,$30.15,-1.01,-3.241%,500617293.00,United States,,88149,Finance,Real Estate
RMTI,Rockwell Medical Inc. Common Stock,$1.91,-0.09,-4.50%,22218405.00,United States,1998,609875,Health Care,Biotechnology: Pharmaceutical Preparations
RNA,Avidity Biosciences Inc. Common Stock,$24.17,-0.07,-0.289%,1606399060.00,United States,2020,505987,Health Care,Biotechnology: Pharmaceutical Preparations
RNAZ,TransCode Therapeutics Inc. Common Stock,$0.6261,-0.034,-5.151%,8125046.00,United States,2021,573597,Health Care,Biotechnology: Pharmaceutical Preparations
RNER,Mount Rainier Acquisition Corp. Common Stock,$9.21,-0.29,-3.053%,204081627.00,United States,2022,3884,Industrials,Consumer Electronics/Appliances
RNERU,Mount Rainier Acquisition Corp. Unit,$9.04,-0.86,-8.687%,0.00,United States,2021,1472,Industrials,Consumer Electronics/Appliances
RNERW,Mount Rainier Acquisition Corp. Warrant,$0.1985,0.0218,12.337%,0.00,United States,2022,62452,Industrials,Consumer Electronics/Appliances
RNLX,Renalytix plc American Depositary Shares,$2.99,0.09,3.103%,111963307.00,United Kingdom,2020,68149,Health Care,Medical Specialities
RNST,Renasant Corporation Common Stock,$38.23,0.49,1.298%,2139087166.00,United States,,268819,Finance,Major Banks
RNW,ReNew Energy Global plc Class A Ordinary Shares,$5.76,-0.09,-1.538%,2231788412.00,United Kingdom,,755186,Utilities,Electric Utilities: Central
RNWWW,ReNew Energy Global plc Warrant,$0.86,0.00,0.00%,0.00,United Kingdom,,133,Utilities,Electric Utilities: Central
RNXT,RenovoRx Inc. Common Stock,$3.10,0.08,2.649%,28202873.00,United States,2021,42851,Health Care,Biotechnology: Pharmaceutical Preparations
ROAD,Construction Partners Inc. Class A Common Stock,$28.71,-0.27,-0.932%,1513609747.00,United States,2018,72998,Industrials,Engineering & Construction
ROC,ROC Energy Acquisition Corp. Common Stock,$10.32,-0.01,-0.097%,277102320.00,United States,2021,879,Industrials,Consumer Electronics/Appliances
ROCAR,ROC Energy Acquisition Corp. Rights,$0.1837,-0.0014,-0.756%,0.00,United States,2021,684,Industrials,Consumer Electronics/Appliances
ROCC,Ranger Oil Corporation Class A Common Stock,$42.15,0.68,1.64%,804653574.00,United States,,281387,Energy,Oil & Gas Production
ROCG,Roth CH Acquisition IV Co. Common Stock,$10.2702,0.00,0.00%,58691615.00,United States,2021,308,Industrials,Consumer Electronics/Appliances
ROCGW,Roth CH Acquisition IV Co. Warrant,$0.25,0.00,0.00%,0.00,United States,2021,10400,Industrials,Consumer Electronics/Appliances
ROCK,Gibraltar Industries Inc. Common Stock,$56.91,-0.40,-0.698%,1762558017.00,United States,1993,140160,,
ROCL,Roth CH Acquisition V Co. Common Stock,$10.21,0.00,0.00%,151480665.00,United States,2022,31,Industrials,Consumer Electronics/Appliances
ROCLU,Roth CH Acquisition V Co. Unit,$10.27,0.03,0.293%,0.00,United States,2021,120,Industrials,Consumer Electronics/Appliances
ROCLW,Roth CH Acquisition V Co. Warrant,$0.0644,0.00,0.00%,0.00,United States,2022,110,Industrials,Consumer Electronics/Appliances
ROIC,Retail Opportunity Investments Corp. Common Stock (MD),$15.82,-0.32,-1.983%,1970203990.00,United States,,592532,Real Estate,Real Estate Investment Trusts
ROIV,Roivant Sciences Ltd. Common Shares,$7.80,0.21,2.767%,5658266539.00,United Kingdom,,9014504,Health Care,Biotechnology: Pharmaceutical Preparations
ROIVW,Roivant Sciences Ltd. Warrant,$1.825,0.085,4.885%,0.00,United Kingdom,,23241,Health Care,Biotechnology: Pharmaceutical Preparations
ROKU,Roku Inc. Class A Common Stock,$62.84,-2.63,-4.017%,8751696385.00,United States,2017,5941272,Telecommunications,Cable & Other Pay Television Services
ROOT,Root Inc. Class A Common Stock,$7.24,-0.10,-1.362%,102084000.00,United States,2020,217326,Finance,Property-Casualty Insurers
ROSE,Rose Hill Acquisition Corporation Class A Ordinary Shares,$10.29,-0.01,-0.097%,199690313.00,United States,2021,6210,Finance,Business Services
ROSEU,Rose Hill Acquisition Corporation Unit,$10.60,0.06,0.569%,0.00,United States,2021,969,Finance,Business Services
ROSEW,Rose Hill Acquisition Corporation Warrant,$0.1111,-0.0227,-16.966%,0.00,United States,2021,543,Finance,Business Services
ROST,Ross Stores Inc. Common Stock,$115.32,-0.77,-0.663%,39712864758.00,United States,1985,3780593,Consumer Discretionary,Clothing/Shoe/Accessory Stores
ROVR,Rover Group Inc. Class A Common Stock,$4.30,-0.16,-3.587%,790138618.00,United States,2021,296512,Consumer Discretionary,Other Consumer Services
RPAY,Repay Holdings Corporation Class A Common Stock,$10.11,-0.18,-1.749%,916866548.00,United States,2018,444080,Technology,EDP Services
RPD,Rapid7 Inc. Common Stock,$50.02,-1.94,-3.734%,2962980718.00,United States,2015,1114138,Technology,Computer Software: Prepackaged Software
RPHM,Reneo Pharmaceuticals Inc. Common Stock,$2.91,0.26,9.811%,71381270.00,United States,2021,97990,Health Care,Biotechnology: Pharmaceutical Preparations
RPID,Rapid Micro Biosystems Inc. Class A Common Stock,$1.40,-0.05,-3.448%,58791999.00,United States,2021,11232,Health Care,Medical Specialities
RPRX,Royalty Pharma plc Class A Ordinary Shares ,$38.96,0.06,0.154%,17185419788.00,United States,2020,1364480,Health Care,Biotechnology: Pharmaceutical Preparations
RPTX,Repare Therapeutics Inc. Common Shares,$12.36,-0.78,-5.936%,518644264.00,Canada,2020,285651,Health Care,Pharmaceuticals and Biotechnology
RRBI,Red River Bancshares Inc. Common Stock,$51.44,-0.47,-0.905%,369540588.00,United States,2019,10569,Finance,Commercial Banks
RRGB,Red Robin Gourmet Burgers Inc. Common Stock,$9.77,0.75,8.315%,155617000.00,United States,2002,534063,Consumer Discretionary,Restaurants
RRR,Red Rock Resorts Inc. Class A Common Stock,$47.28,1.04,2.249%,2742259810.00,United States,2016,488295,Consumer Discretionary,Recreational Games/Products/Toys
RSLS,ReShape Lifesciences Inc. Common Stock,$17.04,10.74,170.476%,8847134.00,United States,2016,11607098,Health Care,Biotechnology: Electromedical & Electrotherapeutic Apparatus
RSSS,Research Solutions Inc Common Stock,$2.17,0.01,0.463%,63574668.00,United States,,13731,Technology,Computer Software: Prepackaged Software
RSVR,Reservoir Media Inc. Common Stock,$7.26,0.04,0.554%,467354543.00,United States,2021,71058,Consumer Discretionary,Movies/Entertainment
RSVRW,Reservoir Media Inc. Warrant,$1.70,0.00,0.00%,0.00,United States,2021,2,Consumer Discretionary,Movies/Entertainment
RTC,Baijiayun Group Ltd. Class A Ordinary Shares,$9.31,-0.04,-0.428%,780045854.00,China,2006,9334,Industrials,Specialty Chemicals
RTL,The Necessity Retail REIT Inc. Class A Common Stock,$6.87,-0.13,-1.857%,922121030.00,United States,,828019,Real Estate,Real Estate Investment Trusts
RTLPO,The Necessity Retail REIT Inc. 7.375% Series C Cumulative Redeemable Preferred Stock,$23.155,-0.057,-0.246%,0.00,United States,,2241,Real Estate,Real Estate Investment Trusts
RTLPP,The Necessity Retail REIT Inc. 7.50% Series A Cumulative Redeemable Perpetual Preferred Stock,$23.96,-0.18,-0.746%,0.00,United States,,11695,Real Estate,Real Estate Investment Trusts
RUBY,Rubius Therapeutics Inc. Common Stock,$0.2784,-0.0155,-5.274%,25159435.00,United States,2018,563744,Health Care,Biotechnology: Biological Products (No Diagnostic Substances)
RUM,Rumble Inc. Class A Common Stock,$10.09,-0.10,-0.981%,2816421468.00,United States,2021,755580,Technology,Computer Software: Prepackaged Software
RUMBW,Rumble Inc. Warrant,$2.20,-0.08,-3.509%,0.00,United States,2021,8431,Technology,Computer Software: Prepackaged Software
RUN,Sunrun Inc. Common Stock,$26.96,-1.43,-5.037%,5745276264.00,United States,2015,5529122,Industrials,Building Products
RUSHA,Rush Enterprises Inc. Common Stock Cl A,$56.99,-0.31,-0.541%,3102356537.00,United States,,146290,Consumer Discretionary,Other Specialty Stores
RUSHB,Rush Enterprises Inc. Class B,$61.56,-0.33,-0.533%,3351132978.00,United States,,9969,Consumer Discretionary,Other Specialty Stores
RUTH,Ruth's Hospitality Group Inc. Common Stock,$17.63,-0.07,-0.395%,585353658.00,United States,2005,338478,Consumer Discretionary,Restaurants
RVLP,RVL Pharmaceuticals plc Ordinary Shares,$1.26,-0.02,-1.563%,125065064.00,United States,2018,17382,Health Care,Biotechnology: Pharmaceutical Preparations
RVMD,Revolution Medicines Inc. Common Stock,$25.90,-1.62,-5.887%,2299681694.00,United States,2020,730366,Health Care, Medicinal Chemicals and Botanical Products 
RVNC,Revance Therapeutics Inc. Common Stock,$34.92,-0.35,-0.992%,2872993483.00,United States,2014,835253,Health Care,Biotechnology: Pharmaceutical Preparations
RVPH,Reviva Pharmaceuticals Holdings Inc. Common Stock ,$4.82,0.15,3.212%,24748545.00,United States,2020,87380,Health Care,Biotechnology: Pharmaceutical Preparations
RVPHW,Reviva Pharmaceuticals Holdings Inc. Warrants,$1.01,-0.05,-4.717%,0.00,United States,2018,10299,Health Care,Biotechnology: Pharmaceutical Preparations
RVSB,Riverview Bancorp Inc Common Stock,$7.41,0.01,0.135%,159367848.00,United States,,10838,Finance,Major Banks
RVSN,Rail Vision Ltd. Ordinary Share,$2.15,0.15,7.50%,34176486.00,Israel,2022,1130354,,
RVSNW,Rail Vision Ltd. Warrant,$0.1938,0.0075,4.026%,0.00,Israel,2022,8815,,
RVYL,Ryvyl Inc. Common Stock,$0.5653,-0.001,-0.177%,28065749.00,United States,,204883,Technology,EDP Services
RWAY,Runway Growth Finance Corp. Common Stock,$12.95,0.12,0.935%,524787393.00,United States,2021,107702,,
RWAYL,Runway Growth Finance Corp. 7.50% Notes due 2027,$25.19,-0.0099,-0.039%,0.00,United States,,1309,,
RWAYZ,Runway Growth Finance Corp. 8.00% Notes due 2027,$25.19,-0.06,-0.238%,0.00,United States,,14796,,
RWLK,ReWalk Robotics Ltd. Ordinary Shares,$0.8445,0.0042,0.50%,52374927.00,Israel,2014,82966,Health Care,Industrial Specialties
RWOD,Redwoods Acquisition Corp. Common Stock,$10.205,-0.085,-0.826%,152105525.00,United States,2022,10919,Industrials,Consumer Electronics/Appliances
RWODR,Redwoods Acquisition Corp. Rights,$0.15,0.0017,1.146%,0.00,United States,2022,3503,Finance,Business Services
RWODU,Redwoods Acquisition Corp. Unit,$10.34,0.00,0.00%,0.00,United States,2022,7,Industrials,Consumer Electronics/Appliances
RWODW,Redwoods Acquisition Corp. Warrants,$0.03,-0.005,-14.286%,0.00,United States,2022,1400,Industrials,Consumer Electronics/Appliances
RXDX,Prometheus Biosciences Inc. Common Stock,$108.68,0.25,0.231%,5052283345.00,United States,2021,320071,Health Care,Biotechnology: Pharmaceutical Preparations
RXRX,Recursion Pharmaceuticals Inc. Class A Common Stock,$9.64,0.27,2.882%,1827317382.00,United States,2021,1311125,Health Care,Biotechnology: Pharmaceutical Preparations
RXST,RxSight Inc. Common Stock,$13.91,-0.08,-0.572%,385607901.00,United States,2021,48042,Health Care,Biotechnology: Electromedical & Electrotherapeutic Apparatus
RXT,Rackspace Technology Inc. Common Stock,$3.32,-0.11,-3.207%,700884788.00,United States,2020,1251617,Technology,EDP Services
RYAAY,Ryanair Holdings plc American Depositary Shares,$94.81,-0.17,-0.179%,21592029400.00,Ireland,1997,412387,Consumer Discretionary,Air Freight/Delivery Services
RYTM,Rhythm Pharmaceuticals Inc. Common Stock,$28.63,-0.27,-0.934%,1613252717.00,United States,2017,371755,Health Care,Biotechnology: Pharmaceutical Preparations
RZLT,Rezolute Inc. Common Stock (NV),$2.69,0.04,1.509%,99066155.00,United States,,14840,Health Care,Biotechnology: Pharmaceutical Preparations
SABR,Sabre Corporation Common Stock,$7.66,0.19,2.544%,2515246876.00,United States,2014,8865840,Consumer Discretionary,Other Consumer Services
SABRP,Sabre Corporation 6.50% Series A Mandatory Convertible Preferred Stock,$101.441,3.581,3.659%,0.00,United States,,71038,Consumer Discretionary,Other Consumer Services
SABS,SAB Biotherapeutics Inc. Common Stock,$0.6904,-0.0466,-6.323%,34792198.00,United States,2021,37917,Health Care,Biotechnology: Pharmaceutical Preparations
SABSW,SAB Biotherapeutics Inc. Warrant,$0.06,-0.0071,-10.581%,0.00,United States,2021,986,Health Care,Biotechnology: Pharmaceutical Preparations
SAFT,Safety Insurance Group Inc. Common Stock,$88.27,1.39,1.60%,1300889541.00,United States,2002,78018,Finance,Property-Casualty Insurers
SAGA,Sagaliam Acquisition Corp. Class A Common Stock,$10.49,0.00,0.00%,156196100.00,United States,2022,103,Industrials,Consumer Electronics/Appliances
SAGE,Sage Therapeutics Inc. Common Stock,$44.16,-0.43,-0.964%,2627241969.00,United States,2014,398881,Health Care,Biotechnology: Pharmaceutical Preparations
SAI,SAI.TECH Global Corporation Class A Ordinary Shares,$1.3348,-0.0341,-2.491%,30118810.00,Singapore,2021,2647,Finance,Investment Bankers/Brokers/Service
SAIA,Saia Inc. Common Stock,$286.36,-1.25,-0.435%,7577790905.00,United States,,746178,Industrials,Trucking Freight/Courier Services
SAITW,SAI.TECH Global Corporation Warrant,$0.11,-0.005,-4.348%,0.00,Singapore,2021,1510,Finance,Investment Bankers/Brokers/Service
SAL,Salisbury Bancorp Inc. Common Stock,$29.82,-0.13,-0.434%,172920693.00,United States,,4711,Finance,Savings Institutions
SALM,Salem Media Group Inc. Class A Common Stock,$1.37,-0.01,-0.725%,37286998.00,United States,1999,40064,Consumer Discretionary,Broadcasting
SAMA,Schultze Special Purpose Acquisition Corp. II Class A Common Stock,$10.18,0.01,0.098%,209962500.00,United States,2021,4425,Industrials,Consumer Electronics/Appliances
SAMAU,Schultze Special Purpose Acquisition Corp. II Units,$10.1701,0.0001,0.001%,0.00,United States,2021,7500,Industrials,Consumer Electronics/Appliances
SAMAW,Schultze Special Purpose Acquisition Corp. II Warrant,$0.0201,0.005,33.113%,0.00,United States,2021,3100,Industrials,Consumer Electronics/Appliances
SAMG,Silvercrest Asset Management Group Inc. Class A Common Stock,$20.06,0.30,1.518%,290241600.00,United States,2013,51124,Finance,Investment Managers
SANA,Sana Biotechnology Inc. Common Stock,$4.68,-0.24,-4.878%,892599763.00,United States,2021,640736,Health Care, Medicinal Chemicals and Botanical Products 
SANG,Sangoma Technologies Corporation Common Shares,$4.79,-0.06,-1.237%,105875320.00,Canada,,20772,,
SANM,Sanmina Corporation Common Stock,$62.77,-0.77,-1.212%,3662827539.00,United States,1993,478782,Technology,Electrical Products
SANW,S&W Seed Company Common Stock (NV),$1.49,-0.02,-1.325%,63508933.00,United States,,51997,Consumer Staples,Farming/Seeds/Milling
SASI,Sigma Additive Solutions Inc. Common Stock,$0.66,0.031,4.928%,3847800.00,United States,,31443,Technology,EDP Services
SASR,Sandy Spring Bancorp Inc. Common Stock,$35.06,0.19,0.545%,1565676313.00,United States,,223740,Finance,Major Banks
SATL,Satellogic Inc. Class A Ordinary Shares,$3.55,-0.21,-5.585%,315929218.00,Uruguay,,21634,Technology,Radio And Television Broadcasting And Communications Equipment
SATS,EchoStar  Corporation Common Stock,$18.79,-0.26,-1.365%,1562029367.00,United States,,167594,Technology,Radio And Television Broadcasting And Communications Equipment
SAVA,Cassava Sciences Inc. Common Stock,$30.92,-0.60,-1.904%,1290463422.00,United States,,1078699,Health Care,Biotechnology: Pharmaceutical Preparations
SBAC,SBA Communications Corporation Class A Common Stock,$297.77,-10.32,-3.35%,32148898250.00,United States,1999,639937,Real Estate,Real Estate Investment Trusts
SBCF,Seacoast Banking Corporation of Florida Common Stock,$33.36,0.04,0.12%,2389176480.00,United States,,916865,Finance,Major Banks
SBET,SharpLink Gaming Ltd. Ordinary Shares,$0.7795,0.1058,15.704%,21270221.00,Israel,,1243042,Utilities,Telecommunications Equipment
