Symbol,Name,Last Sale,Net Change,% Change,Market Cap,Country,IPO Year,Volume,Sector,Industry
PCOR,Procore Technologies Inc. Common Stock,$58.69 ,1.68,2.95%,8231441410,,2021,1033906,Technology,Computer Software: Prepackaged Software
PCQ,PIMCO California Municipal Income Fund Common Stock,$9.56 ,0,0.00%,0,United States,2001,69973,Finance,Investment Managers
PD,PagerDuty Inc. Common Stock,$26.64 ,0.16,0.60%,2433838925,,2019,1311527,Technology,Computer Software: Prepackaged Software
PDI,PIMCO Dynamic Income Fund Common Stock,$18.10 ,0.42,2.38%,4399929000,United States,2012,1000327,Finance,Trusts Except Educational Religious and Charitable
PDM,Piedmont Office Realty Trust Inc. Class A Common Stock,$6.10 ,-0.04,-0.65%,754222013,United States,,2293526,Real Estate,Building operators
PDO,PIMCO Dynamic Income Opportunities Fund Common Shares of Beneficial Interest,$12.61 ,0.12,0.96%,1391927524,,2021,290845,Finance,Trusts Except Educational Religious and Charitable
PDS,Precision Drilling Corporation Common Stock,$44.49 ,-0.94,-2.07%,610482348,Canada,,25798,,
PDT,John Hancock Premium Dividend Fund,$11.11 ,0.01,0.09%,0,United States,,186680,Finance,Finance Companies
PEAK,Healthpeak Properties Inc. Common Stock,$19.47 ,0.19,0.99%,10649946701,United States,,3991361,Real Estate,Real Estate Investment Trusts
PEB,Pebblebrook Hotel Trust Common Shares of Beneficial Interest,$13.58 ,0.09,0.67%,1696940069,United States,2009,1132913,Real Estate,Real Estate Investment Trusts
PEB^E,Pebblebrook Hotel Trust 6.375% Series E Cumulative Redeemable Preferred Shares of Beneficial Interest,$18.50 ,0.25,1.37%,,United States,,2903,,
PEB^F,Pebblebrook Hotel Trust 6.3% Series F Cumulative Redeemable Preferred Shares of Beneficial Interest,$18.70 ,0.68,3.77%,,United States,,2522,,
PEB^G,Pebblebrook Hotel Trust 6.375% Series G Cumulative Redeemable Preferred Shares of Beneficial Interest,$17.89 ,0.08,0.45%,,United States,,18749,,
PEB^H,Pebblebrook Hotel Trust 5.700% Series H Cumulative Redeemable Preferred Shares of Beneficial Interest,$16.99 ,0,0.00%,,United States,,13493,,
PEG,Public Service Enterprise Group Incorporated Common Stock,$59.57 ,-0.26,-0.44%,3036037114,United States,,1799284,Utilities,Electric Utilities: Central
PEN,Penumbra Inc. Common Stock,$306.50 ,1.6,0.53%,11721387550,,2015,254268,Health Care,Medical/Dental Instruments
PEO,Adams Natural Resources Fund Inc. Common Stock,$19.81 ,0.01,0.05%,0,United States,,29406,Finance,Finance/Investors Services
PERF,Perfect Corp. Class A Ordinary Share,$4.90 ,0,0.00%,579492596,,2022,25344,Technology,Computer Software: Prepackaged Software
PFD,Flaherty & Crumrine Preferred and Income Fund Incorporated,$9.67 ,0.08,0.83%,0,United States,1991,21019,Finance,Investment Managers
PFE,Pfizer Inc. Common Stock,$37.60 ,-0.23,-0.61%,2.12264E+11,United States,,20227000,Health Care,Biotechnology: Pharmaceutical Preparations
PFGC,Performance Food Group Company Common Stock,$56.70 ,1.21,2.18%,8853158582,United States,2015,956277,Consumer Discretionary,Food Distributors
PFH,Prudential Financial Inc. 4.125% Junior Subordinated Notes due 2060,$19.63 ,0.2,1.03%,0,United States,2020,32211,Finance,Life Insurance
PFL,PIMCO Income Strategy Fund Shares of Beneficial Interest,$7.78 ,0.0342,0.44%,0,United States,2003,82296,Finance,Finance Companies
PFLT,PennantPark Floating Rate Capital Ltd. Common Stock,$10.75 ,-0.05,-0.46%,534617011,United States,2022,223512,Finance,Finance/Investors Services
PFN,PIMCO Income Strategy Fund II,$6.90 ,0.045,0.66%,0,United States,2004,115438,Finance,Finance/Investors Services
PFO,Flaherty & Crumrine Preferred and Income Opportunity Fund Incorporated,$7.51 ,0.04,0.54%,0,United States,1992,8927,Finance,Finance Companies
PFS,Provident Financial Services Inc Common Stock,$16.36 ,0.17,1.05%,1232320403,United States,2003,307580,Finance,Savings Institutions
PFSI,PennyMac Financial Services Inc. Common Stock,$60.40 ,1.46,2.48%,3018054093,United States,2013,217277,Finance,Finance: Consumer Services
PG,Procter & Gamble Company (The) Common Stock,$145.40 ,0.01,0.01%,3.42703E+11,United States,,4716369,Consumer Discretionary,Package Goods/Cosmetics
PGP,Pimco Global Stocksplus & Income Fund Pimco Global StocksPlus & Income Fund Common Shares of Beneficial Interest,$7.04 ,0.03,0.43%,0,United States,2005,19552,Finance,Finance Companies
PGR,Progressive Corporation (The) Common Stock,$128.49 ,-0.44,-0.34%,75213734904,United States,,3149706,Finance,Property-Casualty Insurers
PGRE,Paramount Group Inc. Common Stock,$4.25 ,-0.06,-1.39%,923149793,United States,2014,1377962,Real Estate,Real Estate Investment Trusts
PGRU,PropertyGuru Group Limited Ordinary Shares,$4.33 ,-0.07,-1.59%,702022147,,2022,16990,Technology,EDP Services
PGSS,Pegasus Digital Mobility Acquisition Corp. Class A Ordinary Shares,$10.60 ,0.012,0.11%,0,,2021,1870,Finance,Blank Checks
PGTI,PGT Innovations Inc.,$26.10 ,0.42,1.64%,1570653212,United States,2006,419784,Industrials,Building Products
PGZ,Principal Real Estate Income Fund Common Shares of Beneficial Interest,$9.26 ,0.02,0.22%,0,,2013,32493,Finance,Investment Managers
PH,Parker-Hannifin Corporation Common Stock,$332.88 ,5.75,1.76%,42707207432,United States,,558201,Industrials,Metal Fabrications
PHD,Pioneer Floating Rate Fund Inc.,$8.33 ,0.01,0.12%,0,United States,2004,56365,Finance,Investment Managers
PHG,Koninklijke Philips N.V. NY Registry Shares,$19.47 ,0.34,1.78%,17162425861,Netherlands,,766594,Health Care,Medical Electronics
PHI,PLDT Inc. Sponsored ADR,$22.14 ,0.09,0.41%,4783474859,Philippines,,49902,Telecommunications,Telecommunications Equipment
PHK,Pimco High Income Fund Pimco High Income Fund,$4.68 ,0.04,0.86%,0,United States,2003,327572,Finance,Finance/Investors Services
PHM,PulteGroup Inc. Common Stock,$65.87 ,-0.65,-0.98%,14703780228,United States,,2493353,Consumer Discretionary,Homebuilding
PHR,Phreesia Inc. Common Stock,$30.16 ,0.26,0.87%,1609188308,United States,2019,378169,Consumer Discretionary,Business Services
PHT,Pioneer High Income Fund Inc.,$6.63 ,0.06,0.91%,0,United States,,122294,Finance,Investment Managers
PHX,PHX Minerals Inc. Common Stock,$2.91 ,-0.04,-1.36%,106229492,United States,2003,38346,Energy,Oil & Gas Production
PHYT,Pyrophyte Acquisition Corp. Class A Ordinary Shares,$10.58 ,0,0.00%,0,,2021,813,Finance,Blank Checks
PIAI,Prime Impact Acquisition I Class A Ordinary Shares,$10.56 ,0,0.00%,0,,2020,21,Finance,Blank Checks
PII,Polaris Inc. Common Stock,$108.15 ,1.95,1.84%,6154445329,United States,,480954,Consumer Discretionary,Industrial Specialties
PIM,Putnam Master Intermediate Income Trust Common Stock,$3.14 ,0.01,0.32%,157795657,United States,1988,56357,Finance,Finance Companies
PINE,Alpine Income Property Trust Inc. Common Stock,$15.31 ,0.13,0.86%,215394706,United States,2019,57085,Real Estate,Real Estate Investment Trusts
PINS,Pinterest Inc. Class A Common Stock,$24.23 ,0.49,2.06%,16581249074,,2019,9135729,Technology,Computer Software: Programming Data Processing
PIPR,Piper Sandler Companies Common Stock,$129.84 ,2.3,1.80%,2306076554,United States,,31201,Finance,Investment Bankers/Brokers/Service
PJT,PJT Partners Inc. Class A Common Stock,$67.53 ,0.59,0.88%,1674757101,United States,2015,115175,Finance,Investment Managers
PK,Park Hotels & Resorts Inc. Common Stock ,$13.11 ,0.1,0.77%,2909165871,United States,2016,1761216,Real Estate,Real Estate Investment Trusts
PKE,Park Aerospace Corp. Common Stock,$13.05 ,0.08,0.62%,267149291,United States,,76738,Industrials,Military/Government/Technical
PKG,Packaging Corporation of America Common Stock,$127.20 ,-0.13,-0.10%,11433195192,United States,2000,355649,Consumer Discretionary,Containers/Packaging
PKST,Peakstone Realty Trust Common Shares,$24.28 ,1.28,5.57%,874056011,,2023,112507,Real Estate,Real Estate Investment Trusts
PKX,POSCO Holdings Inc. American Depositary Shares (Each representing 1/4th of a share of Common Stock),$68.70 ,0.08,0.12%,20850781684,South Korea,1994,106530,Industrials,Steel/Iron Ore
PL,Planet Labs PBC Class A Common Stock,$4.32 ,0.08,1.89%,1187859509,,2021,1056692,Industrials,Aerospace
PLD,Prologis Inc. Common Stock,$124.95 ,2.97,2.44%,1.15385E+11,United States,,2378137,Real Estate,Real Estate Investment Trusts
PLNT,Planet Fitness Inc. Common Stock,$66.35 ,-0.26,-0.39%,5653024645,United States,2015,733886,Consumer Discretionary,Hotels/Resorts
PLOW,Douglas Dynamics Inc. Common Stock,$29.17 ,0.09,0.31%,667607752,United States,2010,92641,Industrials,Construction/Ag Equipment/Trucks
PLTR,Palantir Technologies Inc. Class A Common Stock,$13.65 ,0.81,6.31%,28394660999,,2020,127317410,Technology,Retail: Computer Software & Peripheral Equipment
PLYM,Plymouth Industrial REIT Inc. Common Stock,$21.91 ,0.6,2.82%,942806230,United States,2017,146379,Real Estate,Real Estate Investment Trusts
PM,Philip Morris International Inc Common Stock,$90.84 ,0.08,0.09%,1.40997E+11,United States,,4777184,Health Care, Medicinal Chemicals and Botanical Products 
PMF,PIMCO Municipal Income Fund Common Stock,$9.75 ,-0.06,-0.61%,0,United States,2001,27091,Finance,Finance/Investors Services
PML,Pimco Municipal Income Fund II Common Shares of Beneficial Interest,$8.87 ,0.04,0.45%,0,United States,2002,120139,Finance,Investment Managers
PMM,Putnam Managed Municipal Income Trust Common Stock,$5.61 ,-0.02,-0.36%,273424718,United States,1989,245819,Finance,Investment Managers
PMO,Putnam Municipal Opportunities Trust Common Stock,$9.80 ,0.07,0.72%,333019357,United States,1993,110750,Finance,Finance Companies
PMT,PennyMac Mortgage Investment Trust Common Shares of Beneficial Interest,$11.44 ,0.34,3.06%,1008969779,United States,2009,627966,Real Estate,Real Estate Investment Trusts
PMT^A,PennyMac Mortgage Investment Trust 8.125% Series A Fixed-to-Floating Rate Cumulative Redeemable Preferred Shares of Beneficial Interest,$21.96 ,0.01,0.05%,,United States,,11308,,
PMT^B,PennyMac Mortgage Investment Trust 8.00% Series B Fixed-to-Floating Rate Cumulative Redeemable Preferred Shares of Beneficial Interest,$22.09 ,0.0601,0.27%,,United States,,6295,,
PMT^C,PennyMac Mortgage Investment Trust 6.75% Series C Cumulative Redeemable Preferred Shares of Beneficial Interest,$17.46 ,0.02,0.12%,,United States,,17083,,
PMX,PIMCO Municipal Income Fund III Common Shares of Beneficial Interest,$7.65 ,0.01,0.13%,0,United States,2002,91417,Finance,Trusts Except Educational Religious and Charitable
PNC,PNC Financial Services Group Inc. (The) Common Stock,$118.78 ,-0.21,-0.18%,47406050497,United States,,1803618,Finance,Major Banks
PNF,PIMCO New York Municipal Income Fund Common Stock,$8.54 ,0.0703,0.83%,0,United States,2001,9673,Finance,Finance Companies
PNI,Pimco New York Municipal Income Fund II Common Shares of Beneficial Interest,$7.48 ,0.04,0.54%,0,United States,2002,2312,Finance,Trusts Except Educational Religious and Charitable
PNM,PNM Resources Inc. (Holding Co.) Common Stock,$45.18 ,-0.19,-0.42%,5645649021,United States,,396755,Utilities,Electric Utilities: Central
PNNT,PennantPark Investment Corporation Common Stock,$5.61 ,0.07,1.26%,365909445,United States,2022,411303,Finance,Finance: Consumer Services
PNR,Pentair plc. Ordinary Share,$57.60 ,0.45,0.79%,9500555750,Switzerland,,755900,Industrials,Industrial Machinery/Components
PNTM,Pontem Corporation Class A Ordinary Shares,$10.37 ,0,0.00%,0,,2021,59,Finance,Blank Checks
PNW,Pinnacle West Capital Corporation Common Stock,$76.80 ,0.41,0.54%,14154898099,United States,,677252,Utilities,Electric Utilities: Central
POR,Portland General Electric Co Common Stock,$48.30 ,-0.21,-0.43%,4320022373,United States,,427673,Utilities,Electric Utilities: Central
PORT,Southport Acquisition Corporation Class A Common Stock,$10.44 ,0,0.00%,0,,2022,1,Finance,Blank Checks
POST,Post Holdings Inc. Common Stock,$85.44 ,-0.47,-0.55%,5035469882,United States,2012,354846,Consumer Staples,Packaged Foods
PPG,PPG Industries Inc. Common Stock,$133.73 ,0.69,0.52%,31482187698,United States,,1070173,Consumer Discretionary,Paints/Coatings
PPL,PPL Corporation Common Stock,$26.01 ,0.01,0.04%,22411904725,United States,,6114229,Utilities,Electric Utilities: Central
PPT,Putnam Premier Income Trust Common Stock,$3.58 ,0.01,0.28%,350935504,United States,1988,94560,Finance,Finance Companies
PR,Permian Resources Corporation Class A Common Stock,$9.66 ,0.18,1.90%,3032899272,United States,2022,5880815,Energy,Oil & Gas Production
PRA,ProAssurance Corporation Common Stock,$12.12 ,-0.18,-1.46%,655268600,United States,,549162,Finance,Property-Casualty Insurers
PRE^J,PartnerRe Ltd. 4.875% Fixed Rate Non-Cumulative Redeemable Preferred Shares Series J,$19.41 ,-0.14,-0.72%,,Bermuda,,3657,,
PRG,PROG Holdings Inc. Common Stock,$33.19 ,0.96,2.98%,1570594976,United States,,255006,Consumer Discretionary,Diversified Commercial Services
PRGO,Perrigo Company plc Ordinary Shares,$32.39 ,-0.11,-0.34%,4376189838,United States,,820853,Health Care,Biotechnology: Pharmaceutical Preparations
PRH,Prudential Financial Inc. 5.950% Junior Subordinated Notes due 2062,$24.94 ,0.04,0.16%,0,United States,2022,25699,Finance,Life Insurance
PRI,Primerica Inc. Common Stock,$184.53 ,-0.48,-0.26%,6736264144,United States,2010,90460,Finance,Life Insurance
PRIF^D,Priority Income Fund Inc. 7.00% Series D Term Preferred Stock due 2029,$22.60 ,-0.04,-0.18%,,,,100,,
PRIF^F,Priority Income Fund Inc. 6.625% Series F Term Preferred Stock due 2027,$22.75 ,-0.272,-1.18%,,,,500,,
PRIF^H,Priority Income Fund Inc. 6.00% Series H Term Preferred Stock due 2026,$23.03 ,0,0.00%,,,,932,,
PRIF^I,Priority Income Fund Inc. 6.125% Series I Term Preferred Stock due 2028,$21.76 ,0,0.00%,,,,11,,
PRIF^J,Priority Income Fund Inc. 6.000% Series J Term Preferred Stock due 2028,$21.66 ,-0.0449,-0.21%,,,,744,,
PRIF^K,Priority Income Fund Inc. 7.000% Series K Cumulative Preferred Stock,$19.71 ,0.3875,2.01%,,,,225,,
PRIF^L,Priority Income Fund Inc. 6.375% Series L Term Preferred Stock Due 2029,$21.84 ,-0.0793,-0.36%,,,,1467,,
PRIM,Primoris Services Corporation Common Stock,$27.26 ,0.36,1.34%,1452237028,United States,,167123,Industrials,Water Sewer Pipeline Comm & Power Line Construction
PRLB,Proto Labs Inc. Common stock,$31.73 ,0.54,1.73%,831412401,United States,2012,92854,Industrials,Office Equipment/Supplies/Services
PRM,Perimeter Solutions SA Ordinary Shares,$5.63 ,-0.07,-1.23%,893083854,,2021,1519020,Consumer Discretionary,Newspapers/Magazines
PRMW,Primo Water Corporation Common Stock,$13.29 ,0.15,1.14%,2123587863,Canada,,835775,Consumer Staples,Beverages (Production/Distribution)
PRO,PROS Holdings Inc. Common Stock,$28.46 ,0.17,0.60%,1310041918,United States,2007,310991,Technology,EDP Services
PRPC,CC Neuberger Principal Holdings III Class A Ordinary Shares,$10.70 ,0.09,0.85%,0,,2021,1188,Finance,Blank Checks
PRS,Prudential Financial Inc. 5.625% Junior Subordinated Notes due 2058,$24.42 ,0.165,0.68%,831613158,United States,2018,13349,Finance,Life Insurance
PRT,PermRock Royalty Trust Trust Units,$4.63 ,0.04,0.87%,56327339,United States,2018,42444,Energy,Oil & Gas Production
PRU,Prudential Financial Inc. Common Stock,$80.14 ,0.07,0.09%,29409307820,United States,2001,1679992,Finance,Life Insurance
PSA,Public Storage Common Stock,$286.69 ,3.58,1.27%,50403558621,United States,,832763,Real Estate,Real Estate Investment Trusts
PSA^F,Public Storage Depositary Shares Each Representing 1/1000 of a 5.15% Cumulative Preferred Share of Beneficial Interest Series F par value $0.01 per share,$24.09 ,0.04,0.17%,,United States,,10586,,
PSA^G,Public Storage Depositary Shares Each Representing 1/1000 of a 5.05% Cumulative Preferred Share of Beneficial Interest Series G,$23.87 ,0.04,0.17%,,United States,,11306,,
PSA^H,Public Storage Depositary Shares Each Representing 1/1000 of a  5.60% Cumulative Preferred  Share of Beneficial Interest Series H,$25.17 ,-0.0035,-0.01%,,United States,,11336,,
PSA^I,Public Storage Depositary Shares Each Representing 1/1000 of a 4.875% Cumulative Preferred Share of Beneficial Interest Series I par value $0.01 per share,$22.47 ,0.14,0.63%,,United States,,14219,,
PSA^J,Public Storage Depositary Shares Each Representing 1/1000 of a 4.700% Cumulative Preferred Share of Beneficial Interest Series J par value $0.01 per share,$21.44 ,0.09,0.42%,,United States,,7137,,
PSA^K,Public Storage Depositary Shares Each Representing 1/1000 of a 4.75% Cumulative Preferred Share of Beneficial Interest Series K,$21.56 ,-0.04,-0.19%,,United States,,6352,,
PSA^L,Public Storage Depositary Shares Each Representing 1/1000 of a 4.625% Cumulative Preferred Share of Beneficial Interest Series L par value $0.01 per share,$21.16 ,-0.03,-0.14%,,United States,,10627,,
PSA^M,Public Storage Depositary Shares Each Representing 1/1000 of a 4.125% Cumulative Preferred Share of Beneficial Interest Series M,$18.73 ,0.09,0.48%,,United States,,9464,,
PSA^N,Public Storage Depositary Shares Each Representing 1/1000 of a 3.875% Cumulative Preferred Share of Beneficial Interest Series N,$17.64 ,0.04,0.23%,,United States,,19074,,
PSA^O,Public Storage Depositary Shares Each Representing 1/1000 of a 3.900% Cumulative Preferred Share of Beneficial Interest Series O,$17.96 ,0.2197,1.24%,,United States,,27180,,
PSA^P,Public Storage Depositary Shares Each Representing 1/1000 of a 4.000% Cumulative Preferred Share of Bene cial Interest Series P,$18.48 ,-0.04,-0.22%,,United States,,48747,,
PSA^Q,Public Storage Depositary Shares Each Representing 1/1000 of a 3.950% Cumulative Preferred Share of Beneficial Interest Series Q par value $0.01 per share,$17.87 ,-0.05,-0.28%,,United States,,1964,,
PSA^R,Public Storage Depositary Shares Each Representing 1/1000 of a 4.00% Cumulative Preferred Share of Bene cial Interest Series R,$18.18 ,0.01,0.06%,,United States,,14756,,
PSA^S,Public Storage Depositary Shares Each Representing 1/1000 of a 4.100% Cumulative Preferred Share of Beneficial Interest Series S,$18.60 ,0.07,0.38%,,United States,,10197,,
PSEC^A,Prospect Capital Corporation 5.35% Series A Fixed Rate Cumulative Perpetual Preferred Stock,$14.80 ,-0.1269,-0.85%,,United States,,13343,,
PSF,Cohen & Steers Select Preferred and Income Fund Inc. Common Stock,$17.20 ,0.08,0.47%,206857898,,2010,42818,Finance,Investment Managers
PSFE,Paysafe Limited Common Shares,$9.75 ,-0.15,-1.52%,597353026,,2021,511619,Consumer Discretionary,Business Services
PSN,Parsons Corporation Common Stock,$43.33 ,0.1,0.23%,4537062202,,2019,315115,Technology,EDP Services
PSO,Pearson Plc Common Stock,$9.83 ,0.01,0.10%,7039577570,United Kingdom,,238244,Consumer Discretionary,Books
PSPC,Post Holdings Partnering Corporation Series A Common Stock,$10.23 ,0,0.00%,0,,2021,514256,Finance,Blank Checks
PSTG,Pure Storage Inc. Class A Common Stock,$27.56 ,1.67,6.45%,8489728496,,2015,7192687,Technology,Electronic Components
PSTL,Postal Realty Trust Inc. Class A Common Stock,$14.37 ,-0.02,-0.14%,282848346,,2019,320861,Real Estate,Real Estate Investment Trusts
PSX,Phillips 66 Common Stock,$94.91 ,-0.23,-0.24%,43745232519,United States,,2440554,Energy,Integrated oil Companies
PTA,Cohen & Steers Tax-Advantaged Preferred Securities and Income Fund Common Shares of Beneficial Interest,$16.32 ,-0.01,-0.06%,902062818,,2020,189935,Finance,Trusts Except Educational Religious and Charitable
PTY,Pimco Corporate & Income Opportunity Fund,$12.46 ,0.06,0.48%,0,United States,2002,245043,Finance,Investment Managers
PUK,Prudential Public Limited Company Common Stock,$27.95 ,0.23,0.83%,38476055555,United Kingdom,,783469,Finance,Life Insurance
PUMP,ProPetro Holding Corp. Common Stock,$7.12 ,-0.16,-2.20%,820014280,United States,2017,716994,Energy,Oilfield Services/Equipment
PVH,PVH Corp. Common Stock,$89.01 ,2.06,2.37%,6351729567,United States,,685506,Consumer Discretionary,Apparel
PVL,Permianville Royalty Trust Trust Units ,$2.45 ,0.03,1.24%,80850000,United States,2011,66879,Energy,Oil & Gas Production
PWR,Quanta Services Inc. Common Stock,$174.00 ,1.15,0.67%,25257867666,United States,,811304,Industrials,Engineering & Construction
PWSC,PowerSchool Holdings Inc. Class A Common Stock,$18.16 ,0.01,0.06%,2951387226,United States,2021,432938,Technology,Computer Software: Prepackaged Software
PX,P10 Inc. Class A Common Stock,$10.63 ,0.13,1.24%,1232729008,United States,2021,100650,Finance,Investment Managers
PXD,Pioneer Natural Resources Company Common Stock,$207.93 ,0.33,0.16%,48600630208,United States,,1437569,Energy,Oil & Gas Production
PYN,PIMCO New York Municipal Income Fund III Common Shares of Beneficial Interest,$6.13 ,0.021,0.34%,0,United States,2002,8308,Finance,Investment Managers
PYT,PPlus Tr GSC-2 Tr Ctf Fltg Rate,$22.00 ,0.83,3.92%,0,United States,,201,Finance,Finance: Consumer Services
PZC,PIMCO California Municipal Income Fund III Common Shares of Beneficial Interest,$7.61 ,0.09,1.20%,0,United States,2002,65043,Finance,Investment Managers
QBTS,D-Wave Quantum Inc. Common Shares,$1.67 ,0.42,33.60%,212379840,,2022,16878389,Technology,Retail: Computer Software & Peripheral Equipment
QD,Qudian Inc. American Depositary Shares each representing one Class A Ordinary Share,$1.37 ,0.03,2.24%,345890480,China,2017,244982,Finance,Finance: Consumer Services
QFTA,Quantum FinTech Acquisition Corporation Common Stock,$10.38 ,0,0.00%,0,,2021,38,Finance,Blank Checks
QGEN,Qiagen N.V. Common Shares ,$46.07 ,0.46,1.01%,10490940802,Netherlands,,886996,Health Care,Biotechnology: Biological Products (No Diagnostic Substances)
QS,QuantumScape Corporation Class A Common Stock,$6.32 ,0.08,1.28%,2780608378,United States,2020,2660943,Consumer Discretionary,Auto Parts:O.E.M.
QSR,Restaurant Brands International Inc. Common Shares,$73.22 ,0.79,1.09%,22782020059,Canada,2014,864448,,
QTWO,Q2 Holdings Inc. Common Stock,$27.82 ,0.72,2.66%,1619073980,,2014,591395,Technology,EDP Services
QUAD,Quad Graphics Inc Class A Common Stock,$3.24 ,-0.16,-4.71%,168766951,United States,,108966,Consumer Discretionary,Publishing
QUOT,Quotient Technology Inc. Common Stock,$2.73 ,0.05,1.87%,266654148,,2014,149174,Consumer Discretionary,Advertising
QVCC,QVC Inc. 6.250% Senior Secured Notes due 2068,$9.90 ,0.17,1.75%,0,United States,2019,39715,Consumer Discretionary,Catalog/Specialty Distribution
QVCD,QVC Inc. 6.375% Senior Secured Notes due 2067,$9.96 ,0.16,1.63%,0,United States,2018,14929,Consumer Discretionary,Catalog/Specialty Distribution
R,Ryder System Inc. Common Stock,$79.72 ,-0.32,-0.40%,3706360815,United States,,317415,Consumer Discretionary,Rental/Leasing Companies
RA,Brookfield Real Assets Income Fund Inc. Common Stock,$16.18 ,-0.06,-0.37%,0,,2016,317802,Finance,Investment Managers
RACE,Ferrari N.V. Common Shares,$290.76 ,4.16,1.45%,52792809085,,2015,221861,Consumer Discretionary,Auto Manufacturing
RAD,Rite Aid Corporation Common Stock,$1.84 ,0.08,4.55%,103826353,United States,,3071362,Consumer Staples,Retail-Drug Stores and Proprietary Stores
RAMP,LiveRamp Holdings Inc. Common Stock,$24.97 ,1.33,5.63%,1618297934,United States,2018,732105,Technology,EDP Services
RBA,RB Global Inc. Common Stock,$53.38 ,-1.08,-1.98%,5918847157,Canada,,1852752,Consumer Discretionary,Business Services
RBC,RBC Bearings Incorporated Common Stock,$205.98 ,1.8,0.88%,5977934670,United States,2022,125040,Industrials,Metal Fabrications
RBCP,RBC Bearings Incorporated 5.00% Series A Mandatory Convertible Preferred Stock,$102.98 ,1.01,0.99%,0,United States,2022,4769,Industrials,Metal Fabrications
RBLX,Roblox Corporation Class A Common Stock,$40.12 ,0.61,1.54%,24490940623,United States,2021,4398878,Technology,EDP Services
RBOT,Vicarious Surgical Inc. Class A Common Stock,$2.19 ,-0.01,-0.46%,276989216,Hong Kong,2020,140020,Health Care,Medical Specialities
RBT,Rubicon Technologies Inc. Class A Common Stock,$0.49 ,0.0101,2.10%,30687319,,2022,188129,Technology,Semiconductors
RC,Ready Capital Corproation Common Stock,$10.52 ,0.26,2.53%,1165044322,United States,2013,1472655,Real Estate,Real Estate Investment Trusts
RC^C,Ready Capital Corporation 6.25% Series C Cumulative Convertible Preferred Stock,$18.00 ,0,0.00%,,United States,,4,,
RC^E,Ready Capital Corporation 6.50% Series E Cumulative Redeemable Preferred Stock,$18.30 ,0.1,0.55%,,United States,,1456,,
RCA,Ready Capital Corporation 7.00% Convertible Senior Notes due 2023,$24.90 ,0.0249,0.10%,0,United States,2017,3951,Real Estate,Real Estate Investment Trusts
RCB,Ready Capital Corporation 6.20% Senior Notes due 2026,$23.20 ,-0.3,-1.28%,0,United States,2019,170,Real Estate,Real Estate Investment Trusts
RCC,Ready Capital Corporation 5.75% Senior Notes due 2026,$23.06 ,-0.07,-0.30%,0,United States,2021,16811,Real Estate,Real Estate Investment Trusts
RCI,Rogers Communication Inc. Common Stock,$45.19 ,-0.42,-0.92%,23885931794,Canada,,356934,,
RCL,D/B/A Royal Caribbean Cruises Ltd. Common Stock,$79.00 ,1.1,1.41%,20202820811,United States,1993,1971747,Consumer Discretionary,Marine Transportation
RCS,PIMCO Strategic Income Fund Inc.,$4.93 ,0.07,1.44%,0,United States,1994,76412,Finance,Investment Managers
RCUS,Arcus Biosciences Inc. Common Stock,$22.03 ,4.53,25.89%,1609906093,,2018,4555853,Health Care,Biotechnology: Pharmaceutical Preparations
RDN,Radian Group Inc. Common Stock,$25.64 ,0.41,1.63%,4021238913,United States,,3267629,Finance,Property-Casualty Insurers
RDW,Redwire Corporation Common Stock,$2.41 ,-0.02,-0.82%,154916321,United States,2021,144500,Industrials,Military/Government/Technical
RDY,Dr. Reddy's Laboratories Ltd Common Stock,$54.50 ,0.04,0.07%,9052728768,India,,280485,Health Care,Biotechnology: Pharmaceutical Preparations
RE,Everest Re Group Ltd. Common Stock,$350.06 ,-9.89,-2.75%,15437245531,Bermuda,,344783,Finance,Property-Casualty Insurers
RELX,RELX PLC PLC American Depositary Shares (Each representing One Ordinary Share),$30.69 ,0.47,1.56%,58372942179,United Kingdom,2015,616556,Consumer Discretionary,Business Services
RENN,Renren Inc. American Depositary Shares each representing fifteen Class A ordinary shares,$0.96 ,0.0051,0.53%,24859550,China,2011,16604,Consumer Discretionary,Retail-Auto Dealers and Gas Stations
