Symbol,Name,Last Sale,Net Change,% Change,Market Cap,Country,IPO Year,Volume,Sector,Industry
DAL,Delta Air Lines Inc. Common Stock,$35.89 ,0.14,0.39%,23067099599,United States,,6694066,Consumer Discretionary,Air Freight/Delivery Services
DAN,Dana Incorporated Common Stock ,$13.32 ,0.32,2.46%,1922467635,United States,,1298207,Consumer Discretionary,Auto Parts:O.E.M.
DAO,Youdao Inc. American Depositary Shares each representing one Class A Ordinary Share,$4.47 ,0.35,8.50%,554194873,,2019,199016,Consumer Discretionary,Educational Services
DAR,Darling Ingredients Inc. Common Stock,$63.57 ,-0.79,-1.23%,10165345267,United States,1997,802888,Consumer Staples,Packaged Foods
DASH,DoorDash Inc. Class A Common Stock,$67.44 ,0.94,1.41%,26441584466,,2020,2286213,Industrials,Industrial Machinery/Components
DAVA,Endava plc American Depositary Shares (each representing one Class A Ordinary Share),$51.11 ,1.26,2.53%,2908694377,United Kingdom,2018,283825,Technology,EDP Services
DB,Deutsche Bank AG Common Stock,$10.47 ,0.02,0.19%,21336200641,Germany,,3137017,Finance,Major Banks
DBD,Diebold Nixdorf Incorporated Common Stock,$0.25 ,-0.0029,-1.15%,19902620,United States,,1982717,Technology,EDP Services
DBI,Designer Brands Inc. Class A Common Stock,$6.63 ,-0.11,-1.63%,422022135,United States,,1655504,Consumer Discretionary,Clothing/Shoe/Accessory Stores
DBL,DoubleLine Opportunistic Credit Fund Common Shares of Beneficial Interest,$14.63 ,0.07,0.48%,0,United States,2012,50610,,
DBRG,DigitalBridge Group Inc.,$12.35 ,0.97,8.52%,1998219021,United States,2014,2126541,Real Estate,Real Estate Investment Trusts
DBRG^H,DigitalBridge Group Inc. 7.125% Series H ,$19.30 ,-0.26,-1.33%,,United States,,3579,,
DBRG^I,DigitalBridge Group Inc. 7.15% Series I ,$19.24 ,0.12,0.63%,,United States,,7862,,
DBRG^J,DigitalBridge Group Inc. 7.125% Series J ,$19.09 ,-0.03,-0.16%,,United States,,10211,,
DCF,BNY Mellon Alcentra Global Credit Income 2024 Target Term Fund Inc. Common Stock,$7.57 ,-0.02,-0.26%,0,,2017,10144,Finance,Finance/Investors Services
DCI,Donaldson Company Inc. Common Stock,$64.44 ,1.07,1.69%,7815034397,United States,,316031,Industrials,Pollution Control Equipment
DCO,Ducommun Incorporated Common Stock,$40.76 ,-0.24,-0.59%,499083823,United States,,81414,Industrials,Military/Government/Technical
DCP,DCP Midstream  LP Common Units ,$41.58 ,-0.01,-0.02%,8671535279,United States,,202915,Utilities,Natural Gas Distribution
DCP^B,DCP Midstream LP 7.875% Series B Fixed-to-Floating Rate Cumulative Redeemable Perpetual Preferred Units,$25.39 ,-0.0099,-0.04%,,United States,,15900,,
DCP^C,DCP Midstream LP 7.95% Series C Fixed-to-Floating Rate Cumulative Redeemable Perpetual Preferred Units,$25.40 ,0.15,0.59%,,United States,,4894,,
DD,DuPont de Nemours Inc. Common Stock,$67.60 ,1.07,1.61%,31029488766,,2017,4839129,Industrials,Major Chemicals
DDD,3D Systems Corporation Common Stock,$7.99 ,-0.02,-0.25%,1041544943,United States,,944858,Technology,Computer peripheral equipment
DDL,Dingdong (Cayman) Limited American Depositary Shares (each two representing three Ordinary Shares),$2.57 ,0,0.00%,555953173,,2021,544825,Consumer Discretionary,Catalog/Specialty Distribution
DDS,Dillard's Inc. Common Stock,$287.57 ,3.24,1.14%,5039165028,United States,,91625,Consumer Discretionary,Department/Specialty Retail Stores
DDT,Dillard's Capital Trust I,$25.27 ,-0.0777,-0.31%,0,United States,,6516,Consumer Discretionary,Department/Specialty Retail Stores
DE,Deere & Company Common Stock,$357.21 ,2.33,0.66%,1.05849E+11,United States,,1412863,Industrials,Industrial Machinery/Components
DEA,Easterly Government Properties Inc. Common Stock,$13.63 ,0.41,3.10%,1253669954,United States,2015,2699666,Real Estate,Real Estate Investment Trusts
DECK,Deckers Outdoor Corporation Common Stock,$465.18 ,15.17,3.37%,12261799636,United States,1993,1344850,Consumer Discretionary,Shoe Manufacturing
DEI,Douglas Emmett Inc. Common Stock,$11.34 ,0.17,1.52%,1993681794,United States,2006,2624996,Real Estate,Real Estate Investment Trusts
DELL,Dell Technologies Inc. Class C Common Stock ,$48.51 ,0.43,0.89%,35470747419,,2018,4296654,Technology,Computer Manufacturing
DEN,Denbury Inc. Common Stock,$91.00 ,-0.04,-0.04%,4553606239,,2020,314124,Energy,Oil & Gas Production
DEO,Diageo plc Common Stock,$174.07 ,0.79,0.46%,98077558662,United Kingdom,,254408,Consumer Staples,Beverages (Production/Distribution)
DESP,Despegar.com Corp. Ordinary Shares,$6.67 ,0.16,2.46%,441805412,,2017,331552,Consumer Discretionary,Transportation Services
DFH,Dream Finders Homes Inc. Class A Common Stock,$17.68 ,-0.34,-1.89%,1646546232,United States,2022,166833,Consumer Discretionary,Homebuilding
DFIN,Donnelley Financial Solutions Inc. Common Stock ,$44.83 ,0.76,1.73%,1317777626,,2016,72800,Consumer Discretionary,Other Consumer Services
DFP,Flaherty & Crumrine Dynamic Preferred and Income Fund Inc. Common Stock,$17.23 ,0.14,0.82%,0,,2013,40575,Finance,Investment Managers
DFS,Discover Financial Services Common Stock,$102.36 ,2.48,2.48%,25993915938,United States,,1786049,Finance,Finance: Consumer Services
DG,Dollar General Corporation Common Stock,$205.10 ,1.49,0.73%,44939148633,United States,2009,2603428,Consumer Discretionary,Department/Specialty Retail Stores
DGX,Quest Diagnostics Incorporated Common Stock,$133.77 ,1.08,0.81%,14965901332,United States,,1058401,Health Care,Medical Specialities
DHF,BNY Mellon High Yield Strategies Fund Common Stock,$2.16 ,0.03,1.41%,0,United States,1998,538540,Finance,Finance Companies
DHI,D.R. Horton Inc. Common Stock,$106.71 ,-0.09,-0.08%,36395704764,United States,,3005379,Consumer Discretionary,Homebuilding
DHR,Danaher Corporation Common Stock,$232.21 ,1.76,0.76%,1.71347E+11,United States,,2802837,Industrials,Industrial Machinery/Components
DHT,DHT Holdings Inc.,$8.22 ,0.19,2.37%,1339749531,Jersey,2005,3080648,Consumer Discretionary,Marine Transportation
DHX,DHI Group Inc. Common Stock,$3.75 ,0.14,3.88%,180998520,United States,2007,78954,Consumer Discretionary,Business Services
DIAX,Nuveen Dow 30SM Dynamic Overwrite Fund Common Shares of Beneficial Interest,$14.26 ,0.06,0.42%,0,,2014,105816,Finance,Finance Companies
DIN,Dine Brands Global Inc. Common Stock,$62.79 ,-0.4,-0.63%,986969450,United States,,216642,Consumer Discretionary,Restaurants
DINO,HF Sinclair Corporation Common Stock,$42.94 ,0.1,0.23%,8275835217,United States,1960,2499379,Energy,Oil & Gas Production
DIS,Walt Disney Company (The) Common Stock,$88.29 ,0.15,0.17%,1.61333E+11,United States,,12864831,Consumer Discretionary,Movies/Entertainment
DK,Delek US Holdings Inc. Common Stock,$23.19 ,-0.02,-0.09%,1553581027,United States,2017,940720,Energy,Integrated oil Companies
DKL,Delek Logistics Partners L.P. Common Units representing Limited Partner Interests,$55.33 ,2.46,4.65%,2410649697,United States,2012,84151,Energy,Oil & Gas Production
DKS,Dick's Sporting Goods Inc Common Stock,$125.41 ,3.05,2.49%,10737368555,United States,2002,1950341,Consumer Discretionary,Other Specialty Stores
DLB,Dolby Laboratories Common Stock,$82.11 ,-0.08,-0.10%,7867934238,United States,2005,367806,Technology,EDP Services
DLNG,Dynagas LNG Partners LP Common Units,$2.45 ,-0.05,-2.00%,90165505,Greece,,19734,Consumer Discretionary,Marine Transportation
DLNG^A,Dynagas LNG Partners LP 9.00% Series A Cumulative Redeemable Preferred Units,$21.74 ,-0.5022,-2.26%,,Greece,,967,,
DLNG^B,Dynagas LNG Partners LP 8.75% Series B Fixed to Floating Rate Cumulative Redeemable Perpetual Preferred Units liquidation preference $25.00 per Uni,$21.59 ,-0.7996,-3.57%,,Greece,,8233,,
DLR,Digital Realty Trust Inc. Common Stock,$98.89 ,6.67,7.23%,28806250463,United States,2004,6251802,Real Estate,Real Estate Investment Trusts
DLR^J,Digital Realty Trust Inc. 5.250% Series J Cumulative Redeemable Preferred Stock,$20.59 ,-0.12,-0.58%,,United States,,31660,,
DLR^K,Digital Realty Trust Inc. 5.850% Series K Cumulative Redeemable Preferred Stock par value $0.01 per share,$22.50 ,0.17,0.76%,,United States,,10964,,
DLR^L,Digital Realty Trust Inc. 5.200% Series L Cumulative Redeemable Preferred Stock,$20.59 ,0.035,0.17%,,United States,,18054,,
DLX,Deluxe Corporation Common Stock,$15.15 ,0.2,1.34%,658427333,United States,,233770,Consumer Discretionary,Advertising
DLY,DoubleLine Yield Opportunities Fund Common Shares of Beneficial Interest,$13.55 ,0.11,0.82%,649665305,,2020,134954,Finance,Investment Managers
DM,Desktop Metal Inc. Class A Common Stock,$1.75 ,0.03,1.74%,561390776,,2019,4668925,Technology,Industrial Machinery/Components
DMA,Destra Multi-Alternative Fund Common Stock,$5.53 ,-0.01,-0.18%,0,,2022,27417,Finance,Trusts Except Educational Religious and Charitable
DMB,BNY Mellon Municipal Bond Infrastructure Fund Inc. Common Stock,$10.60 ,0,0.00%,0,,2013,27617,Finance,Trusts Except Educational Religious and Charitable
DMO,Western Asset Mortgage Opportunity Fund Inc. Common Stock,$10.37 ,0.11,1.07%,0,United States,2010,28217,Finance,Trusts Except Educational Religious and Charitable
DMS,Digital Media Solutions Inc. Class A Ordinary Shares,$0.48 ,0.0132,2.83%,19179450,United States,2018,2370,Consumer Discretionary,Advertising
DNA,Ginkgo Bioworks Holdings Inc. Class A Common Stock,$1.52 ,-0.01,-0.65%,3150322241,United States,2021,24700852,Health Care,Biotechnology: Biological Products (No Diagnostic Substances)
DNB,Dun & Bradstreet Holdings Inc. Common Stock,$9.71 ,-0.01,-0.10%,4229256091,United States,2020,1768680,Finance,Finance: Consumer Services
DNMR,Danimer Scientific Inc. Common Stock,$3.01 ,0.04,1.35%,306834512,,2020,517026,Industrials,Major Chemicals
DNOW,NOW Inc. Common Stock,$9.76 ,0.09,0.93%,1075843648,,2014,539678,Industrials,Metal Fabrications
DNP,DNP Select Income Fund Inc. Common Stock,$10.19 ,0.09,0.89%,0,United States,1987,783317,Finance,Investment Managers
DO,Diamond Offshore Drilling Inc. Common Stock,$11.55 ,-0.05,-0.43%,1171365946,United States,2022,855392,Energy,Oil & Gas Production
DOC,Physicians Realty Trust Common Shares of Beneficial Interest,$13.61 ,0.11,0.82%,3246547202,United States,2013,1894554,Real Estate,Real Estate Investment Trusts
DOCN,DigitalOcean Holdings Inc. Common Stock,$36.00 ,1.71,4.99%,3205456848,United States,2021,1492621,Technology,Retail: Computer Software & Peripheral Equipment
DOCS,Doximity Inc. Class A Common Stock,$30.71 ,-0.49,-1.57%,5945162566,,2021,1612829,Technology,Retail: Computer Software & Peripheral Equipment
DOLE,Dole plc Ordinary Shares,$13.46 ,0.19,1.43%,1277343151,,2021,1145458,Consumer Staples,Farming/Seeds/Milling
DOMA,Doma Holdings Inc. Common Stock,$0.31 ,0.02,6.94%,101749760,,2021,402661,Finance,Real Estate
DOOR,Masonite International Corporation Ordinary Shares (Canada),$91.19 ,1.05,1.17%,2025994402,Canada,,110827,Basic Materials,Forest Products
DOUG,Douglas Elliman Inc. Common Stock,$3.25 ,0.08,2.52%,274352072,,2021,301789,Real Estate,Building operators
DOV,Dover Corporation Common Stock,$137.03 ,1.81,1.34%,19163823365,United States,,629667,Industrials,Industrial Machinery/Components
DOW,Dow Inc. Common Stock ,$50.34 ,-0.03,-0.06%,35606227384,,2019,3511045,Industrials,Major Chemicals
DPG,Duff & Phelps Utility and Infrastructure Fund Inc.,$12.05 ,0.085,0.71%,0,United States,2011,81170,Finance,Trusts Except Educational Religious and Charitable
DPZ,Domino's Pizza Inc Common Stock,$299.83 ,-4.67,-1.53%,10619484480,United States,2004,679050,Consumer Discretionary,Food Distributors
DQ,DAQO New Energy Corp. American Depositary Shares each representing five ordinary shares,$38.19 ,-0.15,-0.39%,2863476423,China,2010,572412,Technology,Semiconductors
DRD,DRDGOLD Limited American Depositary Shares,$11.39 ,0.08,0.71%,980328234,South Africa,,361817,Basic Materials,Precious Metals
DRH,Diamondrock Hospitality Company Common Stock,$7.84 ,0.12,1.55%,1654064627,United States,2005,2915565,Real Estate,Real Estate Investment Trusts
DRH^A,Diamondrock Hospitality Company 8.250% Series A Cumulative Redeemable Preferred Stock,$25.16 ,-0.41,-1.60%,,United States,,518,,
DRI,Darden Restaurants Inc. Common Stock,$161.28 ,0.25,0.16%,19503502502,United States,,1158688,Consumer Discretionary,Restaurants
DRQ,Dril-Quip Inc. Common Stock,$23.90 ,-0.1,-0.42%,816707358,United States,1997,199301,Industrials,Metal Fabrications
DSAQ,Direct Selling Acquisition Corp. Class A Common Stock,$10.60 ,0,0.00%,0,,2021,10,Finance,Blank Checks
DSL,DoubleLine Income Solutions Fund Common Shares of Beneficial Interests,$11.36 ,0.3,2.71%,1158683966,,2013,455761,Finance,Trusts Except Educational Religious and Charitable
DSM,BNY Mellon Strategic Municipal Bond Fund Inc. Common Stock,$5.52 ,0.01,0.18%,0,United States,1989,54855,Finance,Investment Managers
DSU,Blackrock Debt Strategies Fund Inc. Common Stock,$9.30 ,0.05,0.54%,0,United States,1998,117150,Finance,Finance Companies
DSX,Diana Shipping inc. common stock,$3.78 ,0.2,5.59%,402332737,Greece,2005,716788,Consumer Discretionary,Marine Transportation
DSX^B,Diana Shipping Inc. Perpetual Preferred Shares Series B (Marshall Islands),$25.22 ,0.1176,0.47%,,Greece,,4549,,
DT,Dynatrace Inc. Common Stock,$49.70 ,0.76,1.55%,14365877541,United States,2019,2908347,Technology,Computer Software: Prepackaged Software
DTB,DTE Energy Company 2020 Series G 4.375% Junior Subordinated Debentures due 2080,$21.00 ,0,0.00%,0,United States,2020,12839,Utilities,Electric Utilities: Central
DTC,Solo Brands Inc. Class A Common Stock,$4.32 ,-0.46,-9.62%,275049907,,2021,1838361,Consumer Discretionary,Recreational Games/Products/Toys
DTE,DTE Energy Company Common Stock,$106.51 ,-0.48,-0.45%,35401188291,United States,,785817,Utilities,Electric Utilities: Central
DTF,DTF Tax-Free Income 2028 Term Fund Inc. Common Stock,$10.68 ,0.0205,0.19%,75079290,United States,1991,4903,Finance,Investment Managers
DTG,DTE Energy Company 2021 Series E 4.375% Junior Subordinated Debentures,$20.41 ,-0.04,-0.20%,0,United States,2021,14534,Utilities,Electric Utilities: Central
DTM,DT Midstream Inc. Common Stock ,$46.15 ,-0.42,-0.90%,4471397676,,2021,533788,Utilities,Oil & Gas Production
DTW,DTE Energy Company 2017 Series E 5.25% Junior Subordinated Debentures due 2077,$23.30 ,0.03,0.13%,0,United States,2017,8696,Utilities,Electric Utilities: Central
DUK,Duke Energy Corporation (Holding Company) Common Stock,$88.70 ,-0.19,-0.21%,68356807475,United States,,3065145,Utilities,Power Generation
DUK^A,Duke Energy Corporation Depositary Shares each representing a 1/1000th interest in a share of 5.75% Series A Cumulative Redeemable Perpetual Preferred Stock,$24.90 ,0.1,0.40%,,United States,,52144,,
DUKB,Duke Energy Corporation 5.625% Junior Subordinated Debentures due 2078,$24.97 ,0.09,0.36%,0,United States,2018,23978,Utilities,Power Generation
DV,DoubleVerify Holdings Inc. Common Stock,$33.39 ,0.58,1.77%,5548199098,,2021,1219009,Technology,Computer Software: Prepackaged Software
DVA,DaVita Inc. Common Stock,$94.28 ,-0.78,-0.82%,8546829139,United States,,413973,Health Care,Misc Health and Biotechnology Services
DVN,Devon Energy Corporation Common Stock,$48.07 ,0.2,0.42%,31437780000,United States,1985,6367230,Energy,Oil & Gas Production
DX,Dynex Capital Inc. Common Stock,$10.91 ,0.36,3.41%,587797132,United States,,1208892,Real Estate,Real Estate Investment Trusts
DX^C,Dynex Capital Inc. 6.900% Series C Fixed-to-Floating Rate Cumulative Redeemable Preferred Stock,$21.58 ,0.1488,0.69%,,United States,,9551,,
DXC,DXC Technology Company Common Stock ,$24.75 ,0.54,2.23%,10458063792,,,1926742,Technology,EDP Services
DY,Dycom Industries Inc. Common Stock,$104.29 ,3.79,3.77%,3061469139,United States,,574349,Industrials,Water Sewer Pipeline Comm & Power Line Construction
E,ENI S.p.A. Common Stock,$28.31 ,0.27,0.96%,47353997460,Italy,,178560,Energy,Oil & Gas Production
EAF,GrafTech International Ltd. Common Stock,$4.46 ,0.12,2.77%,1144785209,United States,2018,1674591,Energy,Industrial Machinery/Components
EAI,Entergy Arkansas LLC First Mortgage Bonds 4.875% Series Due September 1 2066,$22.65 ,0.07,0.31%,0,United States,2016,10547,Utilities,Electric Utilities: Central
EARN,Ellington Residential Mortgage REIT Common Shares of Beneficial Interest,$6.99 ,0.22,3.25%,96390646,United States,2013,138675,Real Estate,Real Estate Investment Trusts
EAT,Brinker International Inc. Common Stock,$38.90 ,0.09,0.23%,1714046343,United States,,732208,Consumer Discretionary,Restaurants
EB,Eventbrite Inc. Class A Common Stock,$7.33 ,-0.01,-0.14%,729891787,United States,2018,780232,Technology,EDP Services
EBF,Ennis Inc. Common Stock,$20.05 ,0.23,1.16%,518353191,United States,,58979,Consumer Discretionary,Office Equipment/Supplies/Services
EBR,Centrais Electricas Brasileiras S A American Depositary Shares (Each representing one Common Share),$7.09 ,-0.03,-0.42%,16357337660,,2016,1411582,Utilities,Electric Utilities: Central
EBS,Emergent Biosolutions Inc. Common Stock,$8.17 ,0.02,0.25%,411755010,United States,2006,765983,Health Care,Biotechnology: Pharmaceutical Preparations
EC,Ecopetrol S.A. American Depositary Shares,$9.34 ,0.11,1.19%,19201496416,Colombia,,1803998,Energy,Oil & Gas Production
ECAT,BlackRock ESG Capital Allocation Term Trust Common Shares of Beneficial Interest,$15.43 ,0.26,1.71%,1579757979,,2021,232192,Finance,Trusts Except Educational Religious and Charitable
ECC           ,Eagle Point Credit Company Inc. Common Stock,$10.26 ,0,0.00%,597408292,United States,2014,400459,Finance,Trusts Except Educational Religious and Charitable
ECC^D,Eagle Point Credit Company Inc. 6.75% Series D Preferred Stock,$19.57 ,0,0.00%,,United States,,11,,
ECCC,Eagle Point Credit Company Inc. 6.50% Series C Term Preferred Stock due 2031,$20.65 ,0.05,0.24%,0,United States,,5109,Finance,Trusts Except Educational Religious and Charitable
ECCV,Eagle Point Credit Company Inc. 5.375% Notes due 2029,$21.51 ,0,0.00%,0,United States,2022,930,Finance,Trusts Except Educational Religious and Charitable
ECCW,Eagle Point Credit Company Inc. 6.75% Notes due 2031,$22.36 ,-0.04,-0.18%,0,United States,2021,921,Finance,Trusts Except Educational Religious and Charitable
ECCX,Eagle Point Credit Company Inc. 6.6875% Notes due 2028,$23.66 ,0.2549,1.09%,0,United States,2022,177,Finance,Trusts Except Educational Religious and Charitable
ECL,Ecolab Inc. Common Stock,$166.91 ,0.18,0.11%,47522775434,United States,,705036,Consumer Discretionary,Package Goods/Cosmetics
ECVT,Ecovyst Inc. Common Stock,$10.51 ,-0.15,-1.41%,1262505973,United States,2017,1840433,Industrials,Major Chemicals
ED,Consolidated Edison Inc. Common Stock,$92.69 ,-0.53,-0.57%,32120811138,United States,,2210729,Utilities,Power Generation
EDD,Morgan Stanley Emerging Markets Domestic Debt Fund Inc. Morgan Stanley Emerging Markets Domestic Debt Fund Inc. Common Stock,$4.65 ,0.04,0.87%,0,United States,2007,118373,Finance,Finance Companies
EDF,Virtus Stone Harbor Emerging Markets Income Fund Common Shares of Beneficial Interest,$3.97 ,-0.03,-0.75%,0,United States,2010,120430,Finance,Investment Managers
EDI,Virtus Stone Harbor Emerging Markets Total Income Fund Common Shares of Beneficial Interest,$4.55 ,-0.04,-0.87%,0,United States,2012,80610,Finance,Finance Companies
EDN,Empresa Distribuidora Y Comercializadora Norte S.A. (Edenor) Empresa Distribuidora Y Comercializadora Norte S.A. (Edenor) American Depositary Shares,$9.14 ,-0.27,-2.87%,400085586,Argentina,2007,1584,Utilities,Electric Utilities: Central
EDR,Endeavor Group Holdings Inc. Class A Common Stock,$22.59 ,0.18,0.80%,6584668988,,2021,1325433,Consumer Discretionary,Services-Misc. Amusement & Recreation
EDU,New Oriental Education & Technology Group Inc. Sponsored ADR representing 10 Ordinary Share (Cayman Islands),$37.57 ,1.57,4.36%,6384554843,China,2006,1531077,Consumer Discretionary,Educational Services
EE,Excelerate Energy Inc. Class A Common Stock,$19.94 ,0.52,2.68%,523508090,,2022,197287,Utilities,Oil/Gas Transmission
EEA,The European Equity Fund Inc. Common Stock,$8.44 ,0.07,0.84%,0,United States,,1603,Finance,Trusts Except Educational Religious and Charitable
EEX,Emerald Holding Inc. Common Stock,$3.40 ,0.05,1.49%,213712695,United States,2017,59302,Consumer Discretionary,Business Services
EFC,Ellington Financial Inc. Common Stock ,$12.92 ,0.5,4.03%,876106182,United States,2010,931666,Finance,Real Estate
EFC^A,Ellington Financial Inc. 6.750% Series A Fixed-to-Floating Rate Cumulative Redeemable Preferred Stock,$20.26 ,0.15,0.75%,,United States,,5363,,
EFC^B,Ellington Financial Inc. 6.250% Series B Fixed-Rate Reset Cumulative Redeemable Preferred Stock,$18.55 ,0.02,0.11%,,United States,,670,,
EFC^C,Ellington Financial Inc. 8.625% Series C Fixed-Rate Reset Cumulative Redeemable Preferred Stock,$21.40 ,0.2,0.94%,,United States,,6509,,
EFR,Eaton Vance Senior Floating-Rate Fund Common Shares of Beneficial Interest,$11.14 ,0.08,0.72%,0,United States,2003,46892,Finance,Trusts Except Educational Religious and Charitable
EFT,Eaton Vance Floating Rate Income Trust Common Shares of Beneficial Interest,$11.19 ,0.07,0.63%,325521744,United States,2004,37349,Finance,Finance Companies
EFX,Equifax Inc. Common Stock,$210.64 ,3.51,1.70%,25833680343,United States,,510569,Finance,Finance: Consumer Services
EFXT,Enerflex Ltd Common Shares,$5.86 ,-0.01,-0.17%,725110657,Canada,2022,6608,Industrials,Industrial Machinery/Components
EGF,Blackrock Enhanced Government Fund Inc. Common Stock,$9.65 ,-0.11,-1.13%,0,United States,2005,3599,Finance,Trusts Except Educational Religious and Charitable
EGGF,EG Acquisition Corp. Class A Common Stock,$10.29 ,0.03,0.29%,289406250,,2021,8067,Finance,Blank Checks
EGLE,Eagle Bulk Shipping Inc. Common Stock,$40.60 ,-0.5,-1.22%,556567577,United States,,255673,Consumer Discretionary,Marine Transportation
EGO,Eldorado Gold Corporation Ordinary Shares,$10.19 ,0.24,2.41%,1884006009,Canada,,1473221,,
EGP,EastGroup Properties Inc. Common Stock,$162.75 ,2.96,1.85%,7227861606,United States,,144994,Real Estate,Real Estate Investment Trusts
EGY,VAALCO Energy Inc.  Common Stock,$3.94 ,0.02,0.51%,422833763,United States,,758569,Energy,Oil & Gas Production
EHAB,Enhabit Inc. Common Stock,$11.55 ,-0.09,-0.77%,578531738,,2022,386988,Health Care,Hospital/Nursing Management
EHC,Encompass Health Corporation Common Stock,$59.91 ,0.12,0.20%,5974669852,United States,,662726,Health Care,Hospital/Nursing Management
EHI,Western Asset Global High Income Fund Inc Common Stock,$6.66 ,-0.03,-0.45%,0,United States,2003,37005,Finance,Investment Managers
EIC,Eagle Point Income Company Inc. Common Stock,$13.65 ,0,0.00%,0,,2019,41047,Finance,Finance/Investors Services
EICA,Eagle Point Income Company Inc. 5.00% Series A Term Preferred Stock due 2026,$23.65 ,0.0699,0.30%,0,,2021,410,Finance,Finance/Investors Services
EIG,Employers Holdings Inc Common Stock,$36.11 ,-0.31,-0.85%,976741845,United States,2007,72480,Finance,Property-Casualty Insurers
EIX,Edison International Common Stock,$65.63 ,-0.03,-0.05%,53575087441,United States,,1644578,Utilities,Electric Utilities: Central
EL,Estee Lauder Companies Inc. (The) Common Stock,$194.44 ,3.34,1.75%,69457895299,United States,1995,2062084,Consumer Discretionary,Package Goods/Cosmetics
ELAN,Elanco Animal Health Incorporated Common Stock,$8.32 ,0.08,0.97%,4093838927,United States,2018,6541477,Health Care,Biotechnology: Pharmaceutical Preparations
ELC,Entergy Louisiana Inc. Collateral Trust Mortgage Bonds 4.875 % Series due September 1 2066,$23.03 ,0.14,0.61%,0,United States,2016,9853,Utilities,Electric Utilities: Central
ELF,e.l.f. Beauty Inc. Common Stock,$101.28 ,-2.87,-2.76%,5397687419,United States,2016,1701398,Consumer Discretionary,Package Goods/Cosmetics
ELME,Elme Communities Common Stock,$15.12 ,0.03,0.20%,1326352512,United States,2000,356123,Real Estate,Real Estate Investment Trusts
ELP,Companhia Paranaense de Energia (COPEL) American Depositary Shares (each representing one Unit consisting one Common Share and four non-voting Class B Preferred Shares),$7.46 ,0.07,0.95%,20414690975,Brazil,2021,173847,Utilities,Electric Utilities: Central
ELS,Equity Lifestyle Properties Inc. Common Stock,$63.81 ,0.44,0.69%,11882038213,United States,,456273,Real Estate,Real Estate Investment Trusts
ELV,Elevance Health Inc. Common Stock,$445.89 ,-4.19,-0.93%,1.05701E+11,United States,,1201444,Health Care,Medical Specialities
EMD,Western Asset Emerging Markets Debt Fund Inc Common Stock,$8.38 ,0.07,0.84%,0,United States,,98674,Finance,Finance/Investors Services
EME,EMCOR Group Inc. Common Stock,$170.86 ,3.38,2.02%,8130264091,United States,,373763,Industrials,Engineering & Construction
EMF,Templeton Emerging Markets Fund Common Stock,$11.56 ,0.23,2.03%,0,United States,1987,9090,Finance,Finance/Investors Services
EMN,Eastman Chemical Company Common Stock,$81.31 ,0.67,0.83%,9687112813,United States,,558160,Industrials,Major Chemicals
EMO,ClearBridge Energy Midstream Opportunity Fund Inc. Common Stock,$27.76 ,0.02,0.07%,0,United States,2011,28636,Finance,Investment Managers
EMP,Entergy Mississippi LLC First Mortgage Bonds 4.90% Series Due October 1 2066,$22.68 ,0.06,0.27%,0,United States,2016,5600,,
EMR,Emerson Electric Company Common Stock,$79.51 ,0.49,0.62%,45439965000,United States,,2533515,Technology,Consumer Electronics/Appliances
ENB,Enbridge Inc Common Stock,$35.88 ,-0.03,-0.08%,72657000000,Canada,,5137870,Energy,Natural Gas Distribution
ENFN,Enfusion Inc. Class A Common Stock,$7.88 ,0.08,1.03%,575819196,,2021,571676,Technology,Computer Software: Prepackaged Software
ENIC,Enel Chile S.A. American Depositary Shares (Each representing 50 shares of Common Stock),$2.94 ,0.01,0.34%,4066993563,,2016,1305424,Utilities,Electric Utilities: Central
ENJ,Entergy New Orleans LLC First Mortgage Bonds 5.0% Series due December 1 2052,$23.60 ,0.2801,1.20%,0,United States,,975,Utilities,Power Generation
ENLC,EnLink Midstream LLC Common Units representing Limited Partner Interests,$9.73 ,-0.05,-0.51%,4579292590,,,2691250,Utilities,Natural Gas Distribution
ENO,Entergy New Orleans LLC First Mortgage Bonds 5.50% Series due April 1 2066,$23.74 ,0.045,0.19%,0,United States,2016,1088,Utilities,Power Generation
